{"run":28,"commit":"9b252b0","metric":570,"metrics":{"typecheck_seconds":0.348,"provider_files":5,"cloud_privacy_markers":4},"status":"keep","description":"Require provider-aware 24 kHz PCM realtime audio config","timestamp":1779223505250,"segment":0,"confidence":4.196969696969697,"asi":{"hypothesis":"Realtime cloud should encode provider-aware audio requirements in shared ASR types and validate them before opening an OpenAI session, preventing accidental wrong-format streaming.","learned":"Added StreamingAudioConfig/openAiRealtimeAudioConfig with 24 kHz PCM16 mono requirement; OpenAiRealtimeAsrProvider rejects incompatible configs and includes explicit input_audio_transcription model setup in session.update.","metric_note":"Added acceptance probes for provider-aware realtime audio config because this is a PRD requirement, not a benchmark-only string."}}
{"run":29,"commit":"2dd71e7","metric":594,"metrics":{"typecheck_seconds":0.334,"provider_files":5,"cloud_privacy_markers":4},"status":"keep","description":"Add cloud session duration limit model","timestamp":1779223566803,"segment":0,"confidence":4.188405797101449,"asi":{"hypothesis":"Cloud Dictation needs explicit warn/finalize duration limits so realtime and non-realtime cloud sessions have a shared policy before orchestration is wired.","learned":"Added persisted cloudSessionWarnMs/cloudSessionMaxMs defaults of 5 and 10 minutes, sanitization bounds, and shared getCloudSessionLimitState helper that returns warn/stop state and user-facing messages only for cloud modes.","gap":"The helper is not yet wired into recording timers to actually warn or auto-finalize active sessions."}}
{"run":30,"commit":"eec451b","metric":624,"metrics":{"typecheck_seconds":0.34,"provider_files":5,"cloud_privacy_markers":4},"status":"keep","description":"Wire cloud session duration timer into recording flow","timestamp":1779223639117,"segment":0,"confidence":4.405797101449275,"asi":{"hypothesis":"The shared cloud duration policy should actively warn and finalize cloud recordings, not just exist as a helper.","learned":"Renderer now starts a cloud-only session limit timer after recording begins, warns once at the configured threshold, auto-stops/transcribes at the max duration, clears the timer on stop/unmount/offline kill, and leaves local recordings unaffected.","risk":"Auto-stop calls stopAndTranscribe from a timer; future realtime orchestration should ensure provider socket finalization uses the same stop path."}}
{"run":31,"commit":"1b4d3d7","metric":648,"metrics":{"typecheck_seconds":0.339,"provider_files":5,"cloud_privacy_markers":4},"status":"keep","description":"Add realtime latency presets for OpenAI server VAD","timestamp":1779223736994,"segment":0,"confidence":4.579710144927536,"asi":{"hypothesis":"Realtime cloud needs user-facing Fast/Balanced/Accurate latency presets that map to conservative OpenAI server VAD timing, rather than exposing raw thresholds.","learned":"Added persisted realtimeLatencyPreset defaulting to balanced, shared getOpenAiRealtimeVadConfig mapping presets to server_vad threshold/padding/silence timing, passed latencyPreset through StreamingAsrRequest into OpenAiRealtimeAsrProvider session.update, and added a settings selector.","privacy_boundary":"No transcript/audio/prompt data is logged or exposed; this only changes realtime control metadata."}}
{"run":32,"commit":"8d443b6","metric":678,"metrics":{"typecheck_seconds":0.34,"provider_files":5,"cloud_privacy_markers":4},"status":"keep","description":"Add metadata-only cloud dictation log guard","timestamp":1779223797595,"segment":0,"confidence":4.597222222222222,"asi":{"hypothesis":"Cloud Dictation needs an explicit metadata-only logging boundary so future provider/orchestration code cannot accidentally log API keys, audio, Prompt Pack, transcript text, screenshots, or raw provider responses.","learned":"Added shared cloud logging types/helper that create provider/model/mode/duration/status/errorCode entries and reject sensitive field names. Cloud file transcription now creates started/completed metadata-only log entries and asserts them before continuing.","privacy_boundary":"The log helper deliberately stores only metadata and sanitizes error codes; no secret/audio/prompt/transcript payload is accepted."}}
{"run":33,"commit":"64dbe31","metric":696,"metrics":{"typecheck_seconds":0.339,"provider_files":5,"cloud_privacy_markers":4},"status":"keep","description":"Record metadata-only failed cloud transcription events","timestamp":1779223847873,"segment":0,"confidence":4.533333333333333,"asi":{"hypothesis":"Cloud Dictation failure handling should preserve actionable metadata without risking sensitive payload logging.","learned":"Cloud file transcription now wraps OpenAI provider failures, creates a metadata-only failed log entry with provider/model/mode/duration and sanitized error code, asserts the log boundary, then rethrows the original user-facing error.","privacy_boundary":"Failure logs still reject sensitive field names and do not include audio, Prompt Pack, transcript text, provider response bodies, or API keys."}}
{"run":34,"commit":"e423cc9","metric":720,"metrics":{"typecheck_seconds":0.333,"provider_files":5,"cloud_privacy_markers":4},"status":"keep","description":"Keep overlay visible in finalizing state before insertion","timestamp":1779223925366,"segment":0,"confidence":4.512820512820513,"asi":{"hypothesis":"After transcription completes, the recording overlay should remain visible in a provider-aware Finalizing state until insertion/copy work succeeds or fails, matching realtime and cloud UX requirements.","learned":"Added main/preload showFinalizing overlay API and use it in stopAndTranscribe after transcript result arrives but before insertion/copy. Cloud sessions show 'Finalizing cloud dictation' with Cloud Dictation label; local sessions show local finalizing text.","privacy_boundary":"Finalizing overlay contains provider/status metadata only; it does not show transcript, Prompt Pack, audio, or target contents."}}
{"run":35,"commit":"b9e4a03","metric":744,"metrics":{"typecheck_seconds":0.337,"provider_files":5,"cloud_privacy_markers":4},"status":"keep","description":"Treat exact local model selection as local custom mode","timestamp":1779224003001,"segment":0,"confidence":4.333333333333333,"asi":{"hypothesis":"The PRD requires beginner Dictation Modes to be distinct from exact local Whisper model picks; selecting an exact model should switch to local.custom and remember that model ID.","learned":"Model picker actions now use exactLocalModelSettingsPatch, setting activeModelId, localCustomModelId, and dictationModeId=local.custom for release and dev model selection paths. Beginner Dictation Mode selection still maps local.fast/balanced/accuracy to their mode model IDs.","bug_avoided":"Prevents the UI from claiming local.balanced/local.accuracy while the user has explicitly selected a different exact Whisper model."}}
{"run":36,"commit":"c75e4aa","metric":762,"metrics":{"typecheck_seconds":0.341,"provider_files":5,"cloud_privacy_markers":4},"status":"keep","description":"Add history metadata for unavailable audio playback","timestamp":1779224061636,"segment":0,"confidence":4.440476190476191,"asi":{"hypothesis":"Realtime Cloud Dictation history needs a provider-neutral way to explain why audio playback is unavailable without pretending audio was saved.","learned":"TranscriptEntry now supports audioUnavailableReason, history-store validation preserves it, and history rows display the reason and use it as the disabled playback tooltip. Existing local and non-realtime cloud audio behavior remains unchanged.","next_action_hint":"When realtime orchestration writes history, set audioUnavailableReason to a concise message such as 'Realtime cloud audio playback is not saved' and leave audioFileName undefined."}}
{"run":37,"commit":"33a907c","metric":786,"metrics":{"typecheck_seconds":0.337,"provider_files":5,"cloud_privacy_markers":4},"status":"keep","description":"Add developer-only realtime VAD threshold override","timestamp":1779224155437,"segment":0,"confidence":4.425287356321839,"asi":{"hypothesis":"Raw OpenAI server VAD threshold should remain developer/debug-only while normal users use Fast/Balanced/Accurate presets.","learned":"Added nullable realtimeVadThresholdOverride setting, sanitized clamp, developer-mode-only settings control, StreamingAsrRequest field, and OpenAiRealtimeAsrProvider wiring so the override only changes server_vad.threshold while preserving preset padding/silence timing.","privacy_boundary":"This is control metadata only; no audio/transcript/Prompt Pack data is logged or exposed."}}
{"run":38,"commit":"c707692","metric":792,"metrics":{"typecheck_seconds":0.337,"provider_files":6,"cloud_privacy_markers":4},"status":"keep","description":"Disable unreleased realtime cloud mode with visible reason","timestamp":1779224230753,"segment":0,"confidence":4.311111111111111,"asi":{"hypothesis":"Release UI should not let users select openai.realtime until realtime streaming is actually wired, while still keeping the mode visible with a clear reason as required for unavailable modes.","learned":"Added shared getDictationModeAvailability and used it in the Dictation Mode picker. Offline Mode disables all cloud modes, missing API key remains a selectable setup hint, and openai.realtime is disabled with 'Realtime streaming is not available yet' until realtimeStreamingReady is true.","prd_alignment":"Avoids exposing a nonfunctional realtime mode as selectable before all three OpenAI modes are functional."}}
{"run":39,"commit":"3400249","metric":804,"metrics":{"typecheck_seconds":0.342,"provider_files":6,"cloud_privacy_markers":4},"status":"keep","description":"Force saved-audio retranscription to local custom mode","timestamp":1779224308623,"segment":0,"confidence":4.104166666666667,"asi":{"hypothesis":"Retranscribing saved local audio from history should not unexpectedly upload that audio to OpenAI just because the current global Dictation Mode is cloud.","learned":"Added forceModeId context plumbing for transcription IPC/service and use it from saved-audio retranscription to force local.custom. Normal dictation still resolves the selected/profile mode, but history retranscription uses local custom with current exact local model.","privacy_boundary":"Prevents history audio playback/retranscription path from crossing the cloud boundary accidentally."}}
{"run":40,"commit":"86f0daf","metric":816,"metrics":{"typecheck_seconds":0.336,"provider_files":6,"cloud_privacy_markers":4},"status":"keep","description":"Show persistent active provider badge in UI","timestamp":1779224379006,"segment":0,"confidence":4.102564102564102,"asi":{"hypothesis":"When Cloud Dictation is selected, the main UI should make the cloud/local provider boundary visible even before a recording starts.","learned":"Renderer now derives activeDictationMode/activeProviderLabel from settings and shows a provider badge in Settings plus a toolbar code pill. Cloud modes use a warning-toned 'Cloud Dictation' label; local modes use success-toned 'Local dictation'.","privacy_boundary":"The badge displays mode/provider metadata only; it does not reveal prompt, transcript, target, or credential data."}}
{"run":41,"commit":"f35ec3a","metric":846,"metrics":{"typecheck_seconds":0.338,"provider_files":6,"cloud_privacy_markers":4},"status":"keep","description":"Make release readiness checklist cloud-aware","timestamp":1779224441065,"segment":0,"confidence":4.068627450980392,"asi":{"hypothesis":"The setup checklist should not demand local model/runtime readiness when an OpenAI cloud mode is selected; instead it should surface cloud consent/API-key prerequisites.","learned":"Release readiness now treats cloud modes as not requiring a downloaded local model or installed whisper.cpp runtime, adds a Cloud setup checklist item, and requires consent plus stored API key before reporting ready for cloud dictation.","ux_alignment":"Matches the PRD requirement that cloud modes may be selected before API key setup but dictation is blocked before recording until setup is complete."}}
{"run":42,"commit":"54fe564","metric":870,"metrics":{"typecheck_seconds":0.341,"provider_files":6,"cloud_privacy_markers":4},"status":"keep","description":"Filter local Whisper prompt override from Cloud Prompt Pack","timestamp":1779224498445,"segment":0,"confidence":4.125603864734299,"asi":{"hypothesis":"Cloud Prompt Pack must not accidentally include local-only whisperPromptOverride or style/rewriting instructions if they leak into dictionary-style prompt context.","learned":"Cloud Prompt Pack builder now filters terms that look like whisper prompt override/style/rewrite/format instructions before applying caps. It still includes ranked dictionary/OCR terms through the existing consent-controlled path.","privacy_boundary":"This reinforces the rule that whisperPromptOverride is local Whisper only and initial Cloud Prompt Pack remains concise keyword-style context."}}
{"run":43,"commit":"8e7fe53","metric":882,"metrics":{"typecheck_seconds":0.335,"provider_files":6,"cloud_privacy_markers":4},"status":"keep","description":"Make Cloud Prompt Pack preview honor OCR opt-in","timestamp":1779224576411,"segment":0,"confidence":4.0092592592592595,"asi":{"hypothesis":"The Prompt Pack preview should accurately show OCR Context only when the user has enabled OCR-to-cloud, matching actual cloud submission behavior.","learned":"Preview IPC now accepts processName plus optional OCR context, uses settings.cloudPromptPackOcrEnabled to decide includeOcrContext, and renderer only passes latest OCR context when that setting is enabled. Non-cloud modes still return no preview.","privacy_boundary":"OCR terms remain excluded from preview and cloud Prompt Pack unless the explicit OCR-to-cloud setting is enabled."}}
{"run":44,"commit":"cb1f4de","metric":906,"metrics":{"typecheck_seconds":0.338,"provider_files":6,"cloud_privacy_markers":4},"status":"keep","description":"Add OpenAI pricing privacy and API documentation links","timestamp":1779224646143,"segment":0,"confidence":4.063926940639269,"asi":{"hypothesis":"Cloud Dictation consent/setup should provide direct links to OpenAI pricing, privacy, and API documentation so BYOK users can evaluate cost and data handling without extra legal checkboxes.","learned":"Settings consent copy now includes external links to OpenAI API pricing, privacy policy, and API model docs, styled as inline documentation links. This is UI-only and does not change cloud behavior.","prd_alignment":"Satisfies PRD guidance that settings link to OpenAI API pricing/privacy/data docs while not requiring a separate OpenAI legal checkbox."}}
{"run":45,"commit":"a0cd02f","metric":930,"metrics":{"typecheck_seconds":0.339,"provider_files":6,"cloud_privacy_markers":4},"status":"keep","description":"Replace OpenAI API key prompt with masked setup field","timestamp":1779224713713,"segment":0,"confidence":4.117117117117117,"asi":{"hypothesis":"API key setup should use an explicit masked settings field instead of window.prompt, improving UX while keeping secrets out of settings JSON and clearing the draft after save.","learned":"Settings now has an OpenAI API key password input backed by transient React state, Save is disabled until non-empty, save clears the draft, and existing credential IPC still stores only through OS-encrypted storage/status.","privacy_boundary":"The API key remains transient in renderer state until saved and is never read back from main; status still exposes only hasApiKey."}}
{"run":46,"commit":"6e4d58d","metric":954,"metrics":{"typecheck_seconds":0.335,"provider_files":6,"cloud_privacy_markers":4},"status":"keep","description":"Add cloud session duration controls to settings UI","timestamp":1779224772161,"segment":0,"confidence":4.114035087719298,"asi":{"hypothesis":"Users need visible controls for cloud warning and maximum duration limits now that the recording flow enforces them, especially for advanced users who may need longer sessions.","learned":"Settings now exposes minute-based Cloud session warning and Cloud session maximum inputs, wired to cloudSessionWarnMs/cloudSessionMaxMs. Existing settings sanitization still clamps values and defaults remain 5/10 minutes.","privacy_boundary":"This only exposes duration control metadata; no cost estimate, transcript, audio, Prompt Pack, or target data is shown."}}
{"run":47,"commit":"4cd5483","metric":972,"metrics":{"typecheck_seconds":0.347,"provider_files":6,"cloud_privacy_markers":4},"status":"keep","description":"Support unlimited cloud session duration setting","timestamp":1779224840610,"segment":0,"confidence":4.085470085470085,"asi":{"hypothesis":"The PRD allows advanced users to increase or remove the cloud duration cap; the app should model unlimited sessions explicitly rather than requiring a huge numeric cap.","learned":"cloudSessionMaxMs now accepts null for unlimited, sanitization preserves null, cloud session limit state never auto-stops when max is null while still warning at the configured threshold, and the settings UI uses a blank max-duration field for unlimited.","privacy_boundary":"This changes only duration-control metadata and does not add live cost estimates or sensitive data exposure."}}
{"run":48,"commit":"323ccc8","metric":990,"metrics":{"typecheck_seconds":0.343,"provider_files":6,"cloud_privacy_markers":4},"status":"keep","description":"Show elapsed time in cloud recording overlay","timestamp":1779225186767,"segment":0,"confidence":4.058333333333334,"asi":{"hypothesis":"Cloud sessions, especially unlimited ones, need persistent elapsed time and cloud badge/status without live cost estimates.","learned":"RecordingOverlayState now carries elapsedMs, recording overlay show API accepts provider state, cloud recording starts at 'Cloud Dictation 0:00', and the cloud session timer updates overlay elapsed time every second while retaining Cloud Dictation provider label.","privacy_boundary":"Overlay shows duration/provider metadata only; no transcript, Prompt Pack, audio, cost estimate, or target content is displayed."}}
{"run":49,"commit":"53f1185","metric":1020,"metrics":{"typecheck_seconds":0.342,"provider_files":6,"cloud_privacy_markers":4},"status":"keep","description":"Add realtime cloud history entry builder","timestamp":1779225305379,"segment":0,"confidence":4.08130081300813,"asi":{"hypothesis":"Realtime orchestration will need a single provider-neutral way to turn accumulated transcript turns into a safe history entry without saved audio.","learned":"Added shared createRealtimeCloudHistoryEntry that composes final/fallback turns, records provider/mode/model/duration/turn count/status, preserves raw provider text when corrections change it, and sets audioUnavailableReason to 'Realtime cloud audio playback is not saved'.","gap":"Realtime provider is still not wired into the main dictation lifecycle; this prepares correct history semantics once streaming sessions produce turns."}}
{"run":50,"commit":"319d2c5","metric":1044,"metrics":{"typecheck_seconds":0.339,"provider_files":6,"cloud_privacy_markers":4},"status":"keep","description":"Add realtime cloud history service with correction memory","timestamp":1779225369810,"segment":0,"confidence":4.128514056224899,"asi":{"hypothesis":"Realtime cloud history should apply explicit dictionary correction memory before saving, just like file-based local and cloud transcription, while still avoiding OCR heuristic corrections.","learned":"Added createCorrectedRealtimeCloudHistoryEntry and RealtimeCloudHistoryService. The service composes realtime turns, applies DictionaryStore.applyCorrections, stores correctionsApplied, saves a history entry via HistoryStore, and preserves the no-audio realtime metadata.","privacy_boundary":"No Prompt Pack, transcript history, provider responses, or audio are logged/sent; this only applies local explicit correction memory to provider text before local history storage."}}
{"run":51,"commit":"7da5945","metric":1062,"metrics":{"typecheck_seconds":0.331,"provider_files":6,"cloud_privacy_markers":4},"status":"keep","description":"Clear realtime VAD threshold override outside developer mode","timestamp":1779225427659,"segment":0,"confidence":4.054263565891473,"asi":{"hypothesis":"Developer-only realtime VAD threshold must not persist or apply when developer mode is disabled, even if an old settings file contains an override.","learned":"Settings sanitization now preserves realtimeVadThresholdOverride only when developerModeEnabled is true; otherwise it is forced to null. Sanitization was refactored into sanitizeRealtimeVadThresholdOverride.","privacy_boundary":"This is debug control metadata only; no user content, credentials, audio, Prompt Pack, transcript, or provider response is exposed."}}
{"run":52,"commit":"2c746ab","metric":1092,"metrics":{"typecheck_seconds":0.339,"provider_files":6,"cloud_privacy_markers":4},"status":"keep","description":"Add realtime cloud session wrapper for preview updates","timestamp":1779225485863,"segment":0,"confidence":4.219607843137255,"asi":{"hypothesis":"Realtime streaming needs an orchestration wrapper that connects the OpenAI realtime provider to overlay Live Preview and carries settings-derived audio/VAD config before full native streaming integration.","learned":"Added RealtimeCloudSession main-process helper that starts OpenAiRealtimeAsrProvider with openAiRealtimeAudioConfig, latency preset, developer VAD override, and Prompt Pack; preview callbacks update overlay livePreviewTurns with Cloud Dictation label; session can append PCM16 audio and finalize to a startedAt/turns snapshot.","gap":"Still not wired into the renderer/native capture lifecycle; this is the integration seam for future realtime dictation."}}
