{"run":213,"commit":"5272201","metric":3018,"metrics":{"typecheck_seconds":0.345,"provider_files":12,"cloud_privacy_markers":4},"status":"keep","description":"Validate realtime PCM chunks at provider boundary","timestamp":1779238284441,"segment":0,"confidence":4.2763532763532766,"asi":{"hypothesis":"Realtime PCM chunks are currently validated at IPC/native-helper boundaries, but provider boundary validation prevents any future direct caller from sending empty or odd-length chunks to OpenAI.","learned":"OpenAiRealtimeAsrProvider.appendPcm16Audio now rejects empty chunks and chunks that do not contain whole 16-bit samples before size checks, base64 encoding, or WebSocket send.","privacy_boundary":"Only audio chunk size/parity metadata is checked locally; invalid audio is not encoded, sent, logged, or persisted, and no credentials, transcripts, Prompt Pack text, screenshots, provider responses, or target contents are exposed."}}
{"run":214,"commit":"14b23eb","metric":3024,"metrics":{"typecheck_seconds":0.342,"provider_files":12,"cloud_privacy_markers":4},"status":"keep","description":"Surface provider failure before realtime append state","timestamp":1779238339731,"segment":0,"confidence":4.284900284900285,"asi":{"hypothesis":"If the realtime provider records a failure and then audio forwarding continues briefly, appendPcm16Audio can report a generic socket-not-connected error instead of the stored provider failure. Checking lastError first preserves the actionable provider error.","learned":"OpenAiRealtimeAsrProvider.appendPcm16Audio now calls throwIfRealtimeFailed before checking socket open state or validating/sending PCM chunks.","privacy_boundary":"Only in-memory provider error propagation changed; no audio chunks are encoded/sent after failure, and no provider responses, credentials, Prompt Pack text, transcripts, screenshots, or target contents are logged or persisted."}}
{"run":215,"commit":"2529baa","metric":3030,"metrics":{"typecheck_seconds":0.352,"provider_files":12,"cloud_privacy_markers":4},"status":"keep","description":"Clarify realtime cloud Prompt Pack behavior in settings","timestamp":1779238398034,"segment":0,"confidence":4.293447293447294,"asi":{"hypothesis":"After changing realtime to use /v1/realtime/transcription_sessions without Prompt Pack text, the settings copy that says all cloud modes send a capped Prompt Pack is inaccurate and can confuse privacy expectations.","learned":"Dictation Mode settings copy now distinguishes file cloud modes, which send audio plus capped Prompt Pack, from realtime cloud mode, which uses /v1/realtime/transcription_sessions without Prompt Pack text.","privacy_boundary":"UI copy now documents that realtime does not send Prompt Pack text; no runtime payloads, credentials, audio chunks, transcripts, screenshots, provider responses, or target contents are changed or exposed."}}
