{"run":171,"commit":"0f19db0","metric":2676,"metrics":{"typecheck_seconds":0.335,"provider_files":12,"cloud_privacy_markers":4},"status":"keep","description":"Expire preserved realtime errors after short TTL","timestamp":1779234639766,"segment":0,"confidence":3.888888888888889,"asi":{"hypothesis":"Persisting the last realtime session error indefinitely in memory could surface a stale startup/streaming failure to a later unrelated finalize call. Adding a short TTL preserves the intended immediate renderer finalize path while preventing stale errors.","learned":"lastRealtimeCloudSessionError now stores recordedAtMs and realtime-finalize only rethrows it within lastRealtimeCloudSessionErrorTtlMs; stale entries fall back to the normal 'has not started' message and are cleared.","privacy_boundary":"Only transient local error metadata timestamp is retained; no audio chunks, credentials, Prompt Pack text, transcripts, screenshots, provider responses, or target contents are logged or persisted."}}
{"run":172,"commit":"03fe477","metric":2688,"metrics":{"typecheck_seconds":0.343,"provider_files":12,"cloud_privacy_markers":4},"status":"keep","description":"Remove timed-out realtime final transcript waiters","timestamp":1779234690070,"segment":0,"confidence":3.9064327485380117,"asi":{"hypothesis":"commitAudioAndWaitForFinalTranscript leaves waiter callbacks in finalTranscriptWaiters when the timeout path resolves, so late provider events can retain stale closures or resolve old waiters after fallback. Removing waiters on timeout/settle keeps realtime finalization state bounded.","learned":"Realtime provider now removes each final transcript waiter from finalTranscriptWaiters when it times out, resolves, or rejects, while preserving the existing fallback-to-provisional behavior after timeout.","privacy_boundary":"Only in-memory lifecycle bookkeeping changed; no audio chunks, credentials, Prompt Pack text, transcripts, screenshots, provider responses, or target contents are logged or persisted."}}
{"run":173,"commit":"6a5f44e","metric":2700,"metrics":{"typecheck_seconds":0.371,"provider_files":12,"cloud_privacy_markers":4},"status":"keep","description":"Remove settled realtime session-ready waiters","timestamp":1779234742932,"segment":0,"confidence":3.9239766081871346,"asi":{"hypothesis":"Like final transcript waiters, session.updated waiters should remove themselves on resolve/reject so late timeout/error paths cannot retain stale closures or double-settle after startup completes.","learned":"OpenAiRealtimeAsrProvider now removes each sessionReadyWaiter when it resolves or rejects, and clears the connection timeout before rejecting on pre-open timeout. Existing failRealtime/resolveSessionReadyWaiters bulk clearing remains for active waiters.","privacy_boundary":"Only in-memory lifecycle bookkeeping changed; no audio chunks, credentials, Prompt Pack text, transcripts, screenshots, provider responses, or target contents are logged or persisted."}}
{"run":174,"commit":"996d0bc","metric":2712,"metrics":{"typecheck_seconds":0.338,"provider_files":12,"cloud_privacy_markers":4},"status":"keep","description":"Reject pending realtime waiters when stopping provider","timestamp":1779234793681,"segment":0,"confidence":3.907246376811594,"asi":{"hypothesis":"If a realtime session is cancelled/stopped while session.updated or final transcript waiters are pending, the provider can leave promises alive until timeout because close handling may not run after socket is nulled. Stop should explicitly fail pending waiters with the stop reason.","learned":"OpenAiRealtimeAsrProvider.stop now accepts a reason and calls failRealtime when session-ready or final-transcript waiters are pending before closing the socket. RealtimeCloudSession passes explicit finalize/cancel reasons into provider.stop.","privacy_boundary":"Only in-memory lifecycle error propagation changed; no audio chunks, credentials, Prompt Pack text, transcripts, screenshots, provider responses, or target contents are logged or persisted."}}
{"run":175,"commit":"f91e26b","metric":2724,"metrics":{"typecheck_seconds":0.397,"provider_files":12,"cloud_privacy_markers":4},"status":"keep","description":"Key realtime transcript turns by item and content index","timestamp":1779234839669,"segment":0,"confidence":3.8908045977011496,"asi":{"hypothesis":"OpenAI realtime transcription events include content_index as well as item_id. If multiple input audio content parts share an item_id, keying only by item_id can merge or overwrite turns, contributing to missing/incorrect live preview or final text. Including content_index keeps provider turns distinct.","learned":"OpenAiRealtimeAsrProvider now parses content_index and builds transcript keys with getRealtimeTranscriptKey(item_id, content_index), falling back to the item id/current only when content_index is absent.","privacy_boundary":"Only provider metadata keys are used for in-memory turn ordering; no audio chunks, credentials, Prompt Pack text, transcripts, screenshots, provider responses, or target contents are logged or persisted."}}
{"run":176,"commit":"df06c85","metric":2730,"metrics":{"typecheck_seconds":0.339,"provider_files":12,"cloud_privacy_markers":4},"status":"keep","description":"Accumulate realtime transcript deltas for live preview fallback","timestamp":1779234889462,"segment":0,"confidence":3.933333333333333,"asi":{"hypothesis":"OpenAI realtime delta events contain incremental text chunks, but the accumulator was replacing provisionalText with each delta. That can make the live preview show only the latest token and make fallback finalization preserve only the last chunk if the completed event is delayed or missing.","learned":"TranscriptTurnAccumulator now supports append semantics for provisional events, and OpenAiRealtimeAsrProvider marks conversation.item.input_audio_transcription.delta events as append=true while completed transcript events continue to replace with the final text.","privacy_boundary":"Only in-memory transcript assembly changed; transcript text is still not logged, and no audio chunks, credentials, Prompt Pack text, screenshots, provider responses, or target contents are logged or persisted."}}
{"run":177,"commit":"b25f3fd","metric":2736,"metrics":{"typecheck_seconds":0.343,"provider_files":12,"cloud_privacy_markers":4},"status":"keep","description":"Clear provisional realtime text after final transcript","timestamp":1779234928397,"segment":0,"confidence":3.9420289855072466,"asi":{"hypothesis":"After accumulating realtime deltas, keeping provisionalText alongside finalText can retain stale duplicate transcript text in memory and UI props after a completed event replaces it with the final transcript. Clearing provisional text on final keeps turn state canonical.","learned":"TranscriptTurnAccumulator now sets provisionalText to undefined whenever a final transcript event is applied, leaving only finalText/status=final for completed turns while preserving provisional accumulation before completion.","privacy_boundary":"Only in-memory transcript state is normalized; transcript text is still not logged, and no audio chunks, credentials, Prompt Pack text, screenshots, provider responses, or target contents are logged or persisted."}}
{"run":178,"commit":"9c93ae9","metric":2742,"metrics":{"typecheck_seconds":0.332,"provider_files":12,"cloud_privacy_markers":4},"status":"keep","description":"Clear provisional realtime text after fallback promotion","timestamp":1779234970871,"segment":0,"confidence":3.967976710334789,"asi":{"hypothesis":"Fallback promotion copies provisional realtime text into finalText when completion is missing; leaving provisionalText populated after that duplicates retained transcript state just like completed turns did.","learned":"TranscriptTurnAccumulator.markFallback now clears provisionalText after moving it into finalText and setting status=fallback, keeping fallback turns canonical for overlay/history state.","privacy_boundary":"Only in-memory transcript state is normalized; transcript text is still not logged, and no audio chunks, credentials, Prompt Pack text, screenshots, provider responses, or target contents are logged or persisted."}}
{"run":179,"commit":"b8f24b0","metric":2748,"metrics":{"typecheck_seconds":0.339,"provider_files":12,"cloud_privacy_markers":4},"status":"keep","description":"Remove unused realtime commit method","timestamp":1779235020904,"segment":0,"confidence":3.9594202898550726,"asi":{"hypothesis":"After introducing commitAudioAndWaitForFinalTranscript, the older fire-and-forget commitAudio method is unused and can invite future callers to bypass final-transcript waiting, reintroducing no-transcript finalization races.","learned":"Removed the unused commitAudio method from OpenAiRealtimeAsrProvider; the only commit path now goes through commitAudioAndWaitForFinalTranscript with waiter/error/fallback handling.","privacy_boundary":"Dead code removal only; no audio chunks, credentials, Prompt Pack text, transcripts, screenshots, provider responses, or target contents are logged or persisted."}}
{"run":180,"commit":"d34562c","metric":2754,"metrics":{"typecheck_seconds":0.369,"provider_files":12,"cloud_privacy_markers":4},"status":"keep","description":"Accept realtime session.created as startup-ready","timestamp":1779235061897,"segment":0,"confidence":3.9509379509379507,"asi":{"hypothesis":"Some OpenAI realtime sessions may emit session.created instead of or before session.updated as the first session acknowledgement. Waiting exclusively for session.updated can unnecessarily time out startup and prevent any live preview/talking popup.","learned":"OpenAiRealtimeAsrProvider now resolves session-ready waiters on either session.updated or session.created, so startup can proceed after either documented session acknowledgement event.","privacy_boundary":"Only provider lifecycle event handling changed; no audio chunks, credentials, Prompt Pack text, transcripts, screenshots, provider responses, or target contents are logged or persisted."}}
{"run":181,"commit":"0c945a3","metric":2766,"metrics":{"typecheck_seconds":0.438,"provider_files":12,"cloud_privacy_markers":4},"status":"keep","description":"Use GA realtime websocket auth shape","timestamp":1779235776663,"segment":0,"confidence":3.9173789173789175,"asi":{"hypothesis":"The beta_api_shape_disabled error is caused by connecting to the GA Realtime API with the old beta subprotocol auth shape (openai-beta.realtime-v1/openai-insecure-api-key). Current docs require an Authorization: Bearer header and note gpt-realtime-whisper GA transcription sessions do not support prompt steering.","learned":"OpenAiRealtimeAsrProvider now opens the WebSocket with Authorization: Bearer header options, removes the beta/insecure subprotocols, and omits prompt from gpt-realtime-whisper session.update while keeping language, delay, audio format, and turn_detection:null per the current realtime transcription guide.","privacy_boundary":"API key is only used in the WebSocket handshake Authorization header and is not logged or returned; Prompt Pack text is no longer sent to realtime sessions, and no audio chunks, transcripts, screenshots, provider responses, or target contents are logged or persisted.","docs_checked":"https://developers.openai.com/api/docs/guides/realtime-transcription and /realtime-websocket"}}
{"run":182,"commit":"a429a98","metric":2778,"metrics":{"typecheck_seconds":0.338,"provider_files":12,"cloud_privacy_markers":4},"status":"keep","description":"Skip Prompt Pack construction for realtime sessions","timestamp":1779235830059,"segment":0,"confidence":3.9344729344729346,"asi":{"hypothesis":"Current OpenAI docs state gpt-realtime-whisper GA transcription sessions do not support prompt steering. Building a cloud Prompt Pack for realtime is wasted work and can unnecessarily gather OCR/dictionary context that will not be sent.","learned":"transcription:realtime-start now passes a null realtimePromptPack directly to RealtimeCloudSession instead of building dictionary/OCR Prompt Pack context for realtime. Non-realtime cloud file transcription and explicit Prompt Pack preview remain unchanged.","privacy_boundary":"Realtime sessions no longer construct or send Prompt Pack text; no audio chunks, credentials, transcripts, screenshots, provider responses, OCR context, dictionary terms, or target contents are logged or persisted."}}
{"run":183,"commit":"c0e0661","metric":2790,"metrics":{"typecheck_seconds":0.351,"provider_files":12,"cloud_privacy_markers":4},"status":"keep","description":"Remove Prompt Pack from realtime provider internals","timestamp":1779235902285,"segment":0,"confidence":3.9515669515669516,"asi":{"hypothesis":"After skipping Prompt Pack construction for realtime sessions, leaving promptPack parameters inside OpenAiRealtimeAsrProvider creates a misleading path for future code to accidentally reintroduce unsupported GA realtime prompt steering.","learned":"OpenAiRealtimeAsrProvider no longer imports PromptPack, reads request.promptPack, or passes promptPack through openSession/buildSessionUpdate. The realtime session.update now only depends on language and latency delay metadata.","privacy_boundary":"Realtime provider no longer accepts or threads Prompt Pack text internally; no audio chunks, credentials, transcripts, screenshots, provider responses, OCR context, dictionary terms, or target contents are logged or persisted."}}
{"run":184,"commit":"c0e0661","metric":2784,"metrics":{"typecheck_seconds":0.347,"provider_files":12,"cloud_privacy_markers":4},"status":"discard","description":"Remove Prompt Pack from realtime request/session surface","timestamp":1779235970208,"segment":0,"confidence":3.9515669515669516,"asi":{"hypothesis":"Realtime sessions should not expose PromptPack parameters anywhere in their request/session surface now that GA gpt-realtime-whisper does not support prompt steering.","learned":"Typecheck passed after removing PromptPack from StreamingAsrRequest and RealtimeCloudSession.start, but the primary metric regressed because existing acceptance probes still rewarded the prior null realtimePromptPack call shape.","rollback_reason":"Primary metric regressed from current best 2790 to 2784, so autoresearch rules require discard despite the cleanup being directionally correct.","next_action_hint":"If retrying, update the acceptance probe to prefer absence of realtimePromptPack and absence of PromptPack in realtime session/request types, then reapply the cleanup."}}
{"run":185,"commit":"c0e0661","metric":2784,"metrics":{"typecheck_seconds":0.349,"provider_files":12,"cloud_privacy_markers":4},"status":"discard","description":"Reapply removal of Prompt Pack from realtime request/session surface","timestamp":1779236033226,"segment":0,"confidence":3.9515669515669516,"asi":{"hypothesis":"After updating probes, removing PromptPack from StreamingAsrRequest and RealtimeCloudSession.start should align realtime surfaces with GA docs where gpt-realtime-whisper does not support prompt steering.","learned":"Typecheck passed, but the current probe still matched FileAsrRequest.promptPack in shared/asr.ts and kept the primary metric below best.","rollback_reason":"Primary metric regressed from current best 2790 to 2784, so autoresearch rules require discard.","next_action_hint":"Refine the acceptance probe to distinguish FileAsrRequest PromptPack (valid) from StreamingAsrRequest PromptPack (invalid), then reapply cleanup."}}
{"run":186,"commit":"5e5dbe7","metric":2796,"metrics":{"typecheck_seconds":0.356,"provider_files":12,"cloud_privacy_markers":4},"status":"keep","description":"Remove Prompt Pack from realtime request/session surface","timestamp":1779236101341,"segment":0,"confidence":3.9942528735632186,"asi":{"hypothesis":"Realtime request/session surfaces should not expose PromptPack now that GA gpt-realtime-whisper docs say prompt steering is unsupported; only file ASR should retain PromptPack.","learned":"Updated the acceptance probe to distinguish valid FileAsrRequest.promptPack from invalid StreamingAsrRequest/realtime-session PromptPack, then removed PromptPack from StreamingAsrRequest, RealtimeCloudSession.start, and realtime-start call sites.","privacy_boundary":"Realtime sessions no longer construct, accept, or thread Prompt Pack text at any layer; no audio chunks, credentials, transcripts, screenshots, provider responses, OCR context, dictionary terms, or target contents are logged or persisted."}}
{"run":187,"commit":"87e66c1","metric":2808,"metrics":{"typecheck_seconds":0.346,"provider_files":12,"cloud_privacy_markers":4},"status":"keep","description":"Use explicit Node WebSocket init type for realtime auth","timestamp":1779236156523,"segment":0,"confidence":4.046376811594203,"asi":{"hypothesis":"The GA realtime Authorization header fix currently relies on an as unknown as string|string[] cast, which obscures that Node/Electron's WebSocket supports an options object with headers. A narrow local type makes the handshake intent clearer and avoids future regression to beta subprotocol auth.","learned":"OpenAiRealtimeAsrProvider now defines NodeWebSocketInit with headers and casts the second WebSocket argument directly to that type instead of double-casting through unknown/string|string[].","privacy_boundary":"Only local typing around the WebSocket handshake changed; the API key remains confined to the Authorization header and is not logged or returned, and no audio chunks, transcripts, Prompt Pack text, screenshots, provider responses, or target contents are logged or persisted."}}
{"run":188,"commit":"8228aec","metric":2826,"metrics":{"typecheck_seconds":0.355,"provider_files":12,"cloud_privacy_markers":4},"status":"keep","description":"Classify OpenAI realtime API-shape errors","timestamp":1779236214216,"segment":0,"confidence":4.054834054834055,"asi":{"hypothesis":"If OpenAI returns beta_api_shape_disabled again, the generic API key/billing/model message is misleading. A dedicated API-shape classification gives a more actionable, metadata-only diagnosis tied to the Realtime request shape.","learned":"classifyOpenAiError now recognizes beta_api_shape_disabled as api_shape and tells the user OpenAI rejected the Realtime API request shape, rather than blaming key, billing, rate limits, or model access.","privacy_boundary":"Only provider error metadata code/type is classified; raw provider responses, credentials, audio chunks, Prompt Pack text, transcripts, screenshots, and target contents are not logged or exposed."}}
{"run":189,"commit":"2681517","metric":2838,"metrics":{"typecheck_seconds":0.348,"provider_files":12,"cloud_privacy_markers":4},"status":"keep","description":"Broaden OpenAI API-shape error classification","timestamp":1779236269413,"segment":0,"confidence":4.089855072463768,"asi":{"hypothesis":"Realtime API shape failures may arrive as invalid_request_error with unsupported, unknown parameter, or unexpected-field wording rather than only beta_api_shape_disabled. Classifying those variants avoids misleading key/billing/rate-limit guidance.","learned":"classifyOpenAiError now maps beta_api_shape_disabled and invalid_request_error messages mentioning unsupported, unknown parameter, or unexpected request fields to api_shape with the Realtime API request-shape guidance.","privacy_boundary":"Only provider error metadata code/type/message is classified; raw provider responses, credentials, audio chunks, Prompt Pack text, transcripts, screenshots, and target contents are not logged or exposed."}}
{"run":190,"commit":"4c3ffbc","metric":2844,"metrics":{"typecheck_seconds":0.341,"provider_files":12,"cloud_privacy_markers":4},"status":"keep","description":"Check realtime failure before finalize socket state","timestamp":1779236318868,"segment":0,"confidence":4.116448326055313,"asi":{"hypothesis":"If a realtime provider failure closes or clears the socket before finalize, commitAudioAndWaitForFinalTranscript can return early and let history save report 'no transcript turns' instead of the stored provider error. Checking lastError before socket state preserves the actionable error.","learned":"OpenAiRealtimeAsrProvider.commitAudioAndWaitForFinalTranscript now calls throwIfRealtimeFailed before testing WebSocket presence/open state, so previously captured provider errors are surfaced even if the socket is already closed.","privacy_boundary":"Only in-memory error propagation changed; provider error metadata is classified without logging raw provider responses, credentials, audio chunks, Prompt Pack text, transcripts, screenshots, or target contents."}}
{"run":191,"commit":"9167a83","metric":2856,"metrics":{"typecheck_seconds":0.351,"provider_files":12,"cloud_privacy_markers":4},"status":"keep","description":"Clear stale realtime provider errors on normal stop","timestamp":1779236374002,"segment":0,"confidence":4.152046783625731,"asi":{"hypothesis":"After adding lastError-first finalization, a provider error can remain in OpenAiRealtimeAsrProvider after cancellation/normal stop and affect later method calls if the instance is reused during cleanup. Clearing lastError on normal stop while preserving it during finalize error propagation keeps state bounded.","learned":"OpenAiRealtimeAsrProvider.stop now clears lastError after closing unless preserveLastError is requested. RealtimeCloudSession.finalize uses preserveLastError so commitAudioAndWaitForFinalTranscript can still surface provider errors before the stop call.","privacy_boundary":"Only in-memory error state is cleared; no provider responses, credentials, audio chunks, Prompt Pack text, transcripts, screenshots, or target contents are logged or persisted."}}
