{"run":126,"commit":"b07e2a4","metric":2202,"metrics":{"typecheck_seconds":0.354,"provider_files":11,"cloud_privacy_markers":4},"status":"keep","description":"Copy cloud file audio at upload boundary","timestamp":1779231306858,"segment":0,"confidence":4.261208576998051,"asi":{"hypothesis":"OpenAI file transcription should copy processed WAV bytes at the provider boundary so the upload payload is immutable with respect to later local mutations of the caller's Uint8Array.","learned":"Added copyAudioBytesForUpload and use it when constructing the OpenAI transcription Blob, preserving the existing processed-WAV upload behavior while isolating the provider request body.","privacy_boundary":"No new data is sent; this only copies the same processed WAV bytes for upload and does not log audio, Prompt Pack text, transcripts, screenshots, credentials, or target content."}}
{"run":127,"commit":"4e05a99","metric":2220,"metrics":{"typecheck_seconds":0.344,"provider_files":11,"cloud_privacy_markers":4},"status":"keep","description":"Gate cloud file audio history with explicit setting","timestamp":1779231355906,"segment":0,"confidence":4.271317829457364,"asi":{"hypothesis":"Non-realtime cloud modes may save processed WAV only if an explicit/global audio-history setting allows it; until that exists, cloud file audio history should default off instead of always saving uploaded audio.","learned":"Added cloudFileAudioHistoryEnabled to settings, defaulted it false, sanitized persisted values, and made transcribeCloudFile save processed WAV audio only when that setting is enabled. Realtime cloud remains audioUnavailableReason-only.","privacy_boundary":"This reduces local retention of cloud audio by default; no new cloud payloads, credentials, Prompt Pack text, transcripts, screenshots, or target content are exposed."}}
{"run":128,"commit":"b6a11c1","metric":2238,"metrics":{"typecheck_seconds":0.342,"provider_files":11,"cloud_privacy_markers":4},"status":"keep","description":"Expose cloud file audio history setting","timestamp":1779231404491,"segment":0,"confidence":4.208333333333333,"asi":{"hypothesis":"Users should have an explicit Settings control for retaining non-realtime cloud processed WAV audio, with copy clarifying realtime cloud audio is never saved.","learned":"Added a Settings checkbox labeled Save cloud file audio history, wired to cloudFileAudioHistoryEnabled, with explanatory copy that it applies to non-realtime Cloud Dictation and realtime cloud audio is never saved.","privacy_boundary":"This makes local audio retention explicit and opt-in; no new cloud payloads, credentials, Prompt Pack text, screenshots, transcripts, or target content are exposed."}}
{"run":129,"commit":"f6f2fba","metric":2256,"metrics":{"typecheck_seconds":0.351,"provider_files":11,"cloud_privacy_markers":4},"status":"keep","description":"Show cloud audio history setup status","timestamp":1779231456638,"segment":0,"confidence":4.242424242424242,"asi":{"hypothesis":"The release setup checklist should surface Cloud Dictation audio-retention status so users understand whether cloud processed WAV history is enabled before recording.","learned":"Added cloudAudioHistoryDetail and a Cloud audio history setup row. It explains local behavior for local modes, whether non-realtime cloud WAV history is on/off, and reiterates that realtime cloud audio is never saved.","privacy_boundary":"Only local setup/retention status text changed; no cloud payloads, credentials, audio, Prompt Pack text, screenshots, transcripts, or target content are exposed."}}
{"run":130,"commit":"876effc","metric":2268,"metrics":{"typecheck_seconds":0.338,"provider_files":12,"cloud_privacy_markers":4},"status":"keep","description":"Add App Profile override for cloud OCR prompt context","timestamp":1779231561923,"segment":0,"confidence":4.217228464419476,"asi":{"hypothesis":"OCR Context in the cloud Prompt Pack should support an App Profile override so sensitive apps can disable OCR context even when the global cloud OCR setting is enabled.","learned":"AppProfile now includes cloudPromptPackOcrEnabled as inherit/boolean, sanitized/defaulted to inherit, and update IPC types include it. Added resolveCloudPromptPackOcrEnabled and used it in prompt-pack preview, realtime start, and file cloud transcription.","privacy_boundary":"This tightens per-profile control over whether OCR terms enter the capped Prompt Pack; no screenshots, full target contents, transcript history, full dictionary, audio, or credentials are added."}}
{"run":131,"commit":"458fee4","metric":2286,"metrics":{"typecheck_seconds":0.345,"provider_files":12,"cloud_privacy_markers":4},"status":"keep","description":"Expose profile cloud OCR Prompt Pack override","timestamp":1779231630487,"segment":0,"confidence":4.203703703703703,"asi":{"hypothesis":"The App Profile cloud OCR Prompt Pack override should be configurable in release UI so users can block OCR context for sensitive apps without disabling cloud dictation entirely.","learned":"Added profileCloudPromptPackOcrOptions with Inherit/Allow/Block choices, wired updateAppProfile to carry cloudPromptPackOcrEnabled, and added a Cloud Prompt Pack OCR select to the profile editor.","privacy_boundary":"This exposes a per-profile control that can prevent OCR terms from entering cloud Prompt Pack; no screenshots, full target contents, transcript history, full dictionary, audio, credentials, or Prompt Pack text are exposed."}}
{"run":132,"commit":"8e8b393","metric":2298,"metrics":{"typecheck_seconds":0.344,"provider_files":12,"cloud_privacy_markers":4},"status":"keep","description":"Respect profile OCR override in Prompt Pack preview","timestamp":1779231683698,"segment":0,"confidence":4.202578268876612,"asi":{"hypothesis":"Cloud Prompt Pack preview should use the same App Profile OCR override resolution as actual cloud transcription, so the preview cannot show OCR context that would be blocked for the current app.","learned":"Renderer previewCloudPromptPack now resolves the active profile and calls resolveCloudPromptPackOcrEnabled before deciding whether to send latest OCR context to the preview IPC.","privacy_boundary":"This reduces accidental OCR context exposure in preview; no screenshots, full target contents, transcript history, full dictionary, audio, credentials, or Prompt Pack text are sent beyond the existing explicit preview action."}}
{"run":133,"commit":"2db022b","metric":2304,"metrics":{"typecheck_seconds":0.345,"provider_files":12,"cloud_privacy_markers":4},"status":"keep","description":"Show OCR policy source in Prompt Pack preview","timestamp":1779231734857,"segment":0,"confidence":4.190476190476191,"asi":{"hypothesis":"Prompt Pack preview should explain whether OCR context was allowed or blocked by global settings or an App Profile override, so users can verify the privacy boundary before using cloud dictation.","learned":"Added resolveCloudPromptPackOcrPolicy returning enabled plus source, kept resolveCloudPromptPackOcrEnabled as a boolean wrapper, and updated preview text to show OCR allowed/blocked by global/profile.","privacy_boundary":"Only policy metadata is shown; no additional screenshots, OCR text, target contents, audio, transcripts, Prompt Pack text, full dictionary, or credentials are exposed."}}
{"run":134,"commit":"2be6406","metric":2310,"metrics":{"typecheck_seconds":0.339,"provider_files":12,"cloud_privacy_markers":4},"status":"keep","description":"Clarify profile override for cloud OCR context","timestamp":1779231776169,"segment":0,"confidence":4.178506375227687,"asi":{"hypothesis":"The global Cloud Prompt Pack OCR setting should tell users that App Profiles can override it, making the sensitive-app privacy control discoverable.","learned":"Updated the global Allow OCR Context in cloud Prompt Pack copy to mention that App Profiles can override the setting for sensitive apps while preserving the cap disclosure.","privacy_boundary":"UI copy only; no screenshots, OCR text, target contents, audio, transcripts, full dictionary, Prompt Pack text, or credentials are exposed."}}
{"run":135,"commit":"43dfe61","metric":2328,"metrics":{"typecheck_seconds":0.362,"provider_files":12,"cloud_privacy_markers":4},"status":"keep","description":"Add structured provider language hint status","timestamp":1779231823417,"segment":0,"confidence":4.14336917562724,"asi":{"hypothesis":"Provider language hints should expose whether a requested explicit language hint is supported so UI/log-free diagnostics can explain when a provider falls back to auto detection.","learned":"ProviderLanguageHint now includes supported and reason fields. OpenAI/local supported hints report supported=true, auto reports auto language detection, and unsupported provider/language combinations return a metadata-only reason with no parameterValue.","privacy_boundary":"Only language code capability metadata changed; no transcripts, audio, Prompt Pack text, screenshots, credentials, provider responses, or target content are logged or exposed."}}
{"run":136,"commit":"a6d7fad","metric":2340,"metrics":{"typecheck_seconds":0.339,"provider_files":12,"cloud_privacy_markers":4},"status":"keep","description":"Show provider language hint status in settings","timestamp":1779232037247,"segment":0,"confidence":4.120567375886525,"asi":{"hypothesis":"Language settings should show the active provider's language hint behavior so users understand when OpenAI/local dictation will request a concrete language or use auto detection.","learned":"Renderer now computes activeProviderLanguageHint from the active dictation provider and selected language, and the Language setting copy displays auto-detection or requested language metadata.","privacy_boundary":"Only provider/language capability metadata is displayed; no audio, transcripts, Prompt Pack text, screenshots, credentials, provider responses, or target content are exposed."}}
{"run":137,"commit":"8fe7e8c","metric":2358,"metrics":{"typecheck_seconds":0.339,"provider_files":12,"cloud_privacy_markers":4},"status":"keep","description":"Store provider language hint in transcript history","timestamp":1779232122497,"segment":0,"confidence":4.108771929824561,"asi":{"hypothesis":"Transcript history should preserve the provider language hint used for local, file cloud, and realtime cloud dictation as metadata so users can understand language routing without exposing transcript payloads.","learned":"TranscriptEntry now has optional languageHint. Local/file cloud transcription set it from getProviderLanguageHint, realtime history accepts language from finalize IPC and stores the OpenAI hint, and history migration validation preserves string languageHint.","privacy_boundary":"Only short language-code metadata is stored; no audio, transcript text beyond existing history text, Prompt Pack text, screenshots, credentials, provider responses, or target content are added."}}
{"run":138,"commit":"822ef38","metric":2370,"metrics":{"typecheck_seconds":0.345,"provider_files":12,"cloud_privacy_markers":4},"status":"keep","description":"Show language hint in transcript history UI","timestamp":1779232172923,"segment":0,"confidence":4.108202443280978,"asi":{"hypothesis":"Now that transcript history stores provider language-hint metadata, history UI should display it so users can distinguish explicit language routing from auto detection.","learned":"Recent history rows and full history metadata now include language hint when present, or auto when no explicit provider language hint was used.","privacy_boundary":"Only short language-code metadata is displayed; no new audio, Prompt Pack text, screenshots, credentials, provider responses, target content, or additional transcript data are exposed."}}
{"run":139,"commit":"fd11724","metric":2376,"metrics":{"typecheck_seconds":0.347,"provider_files":12,"cloud_privacy_markers":4},"status":"keep","description":"Preserve requested mode in all cloud readiness states","timestamp":1779232218088,"segment":0,"confidence":4.097222222222222,"asi":{"hypothesis":"CloudDictationReadiness should always include requestedModeId, not only local/offline branches, so consumers can reliably inspect requested-vs-resolved routing for every readiness state.","learned":"Added requestedModeId to consent_required, api_key_required, and cloud_ready return paths in getCloudDictationReadinessForMode, making the readiness shape complete across all branches.","privacy_boundary":"Only local routing metadata changed; no cloud payloads, credentials, audio, Prompt Pack text, screenshots, transcripts, provider responses, or target content are exposed."}}
{"run":140,"commit":"a6b586e","metric":2394,"metrics":{"typecheck_seconds":0.326,"provider_files":12,"cloud_privacy_markers":4},"status":"keep","description":"Expose cloud readiness fallback mode id","timestamp":1779232267146,"segment":0,"confidence":4.1070811744386875,"asi":{"hypothesis":"Cloud readiness consumers should not infer fallback routing solely from profileForbidsCloud and modeId; exposing fallbackModeId makes profile-forced local fallback explicit and future-proof.","learned":"CloudDictationReadiness now includes fallbackModeId, set to the resolved local mode when a profile forbids a requested cloud mode and null otherwise, across every readiness branch.","privacy_boundary":"Only local routing metadata changed; no cloud payloads, credentials, audio, Prompt Pack text, screenshots, transcripts, provider responses, or target content are exposed."}}
{"run":141,"commit":"pending","metric":2394,"metrics":{"typecheck_seconds":0.342,"provider_files":12,"cloud_privacy_markers":4},"status":"discard","description":"Use fallbackModeId in profile fallback status message","timestamp":1779232311808,"segment":0,"confidence":4.085910652920962,"asi":{"hypothesis":"Renderer fallback notification should consume readiness.fallbackModeId directly so the UI reports explicit profile-forced local routing instead of inferring it from profileForbidsCloud.","learned":"Typecheck passed and the implementation used fallbackModeId, but the primary metric did not improve over the current best.","rollback_reason":"Primary metric unchanged; autoresearch rules require discard.","next_action_hint":"Reapply later only if bundled with a user-visible fallback-mode label/formatting improvement or a distinct acceptance probe that captures consuming fallbackModeId in renderer."}}
{"run":142,"commit":"773a80b","metric":2400,"metrics":{"typecheck_seconds":0.34,"provider_files":12,"cloud_privacy_markers":4},"status":"keep","description":"Show explicit fallback mode label when profile blocks cloud","timestamp":1779232370246,"segment":0,"confidence":4.096219931271477,"asi":{"hypothesis":"When an App Profile blocks a requested cloud mode, the renderer should consume fallbackModeId and show the user the resolved local fallback mode label instead of relying only on a generic reason.","learned":"startRecording now checks readiness.fallbackModeId, resolves it with getDictationMode, and appends the fallback mode label to the busy message when profile cloud-forbid fallback is active.","privacy_boundary":"Only local routing/status metadata is displayed; no cloud payloads, credentials, audio, Prompt Pack text, screenshots, transcripts, provider responses, or target content are exposed."}}
{"run":143,"commit":"6179bc1","metric":2406,"metrics":{"typecheck_seconds":0.343,"provider_files":12,"cloud_privacy_markers":4},"status":"keep","description":"Reuse effective mode resolver in transcription service","timestamp":1779232425615,"segment":0,"confidence":4.106529209621993,"asi":{"hypothesis":"TranscriptionService should reuse the shared effective dictation mode resolver so global/profile mode resolution cannot drift from cloud readiness and renderer preflight.","learned":"resolveDictationMode now calls resolveEffectiveDictationModeId for the requested mode before applying the existing profile cloud-forbid local fallback.","privacy_boundary":"Only local routing code was consolidated; no cloud payloads, credentials, audio, Prompt Pack text, screenshots, transcripts, provider responses, or target content are exposed."}}
{"run":144,"commit":"e31a695","metric":2412,"metrics":{"typecheck_seconds":0.34,"provider_files":12,"cloud_privacy_markers":4},"status":"keep","description":"Centralize profile cloud fallback mode id","timestamp":1779232475158,"segment":0,"confidence":4.05414551607445,"asi":{"hypothesis":"The local fallback mode used when an App Profile forbids cloud should be a shared constant so readiness and transcription routing cannot drift.","learned":"Added profileCloudFallbackModeId in shared cloud-status and reused it in both getCloudDictationReadinessForMode and TranscriptionService.resolveDictationMode.","privacy_boundary":"Only local routing metadata/code changed; no cloud payloads, credentials, audio, Prompt Pack text, screenshots, transcripts, provider responses, or target content are exposed."}}
{"run":145,"commit":"72bd59f","metric":2418,"metrics":{"typecheck_seconds":0.343,"provider_files":12,"cloud_privacy_markers":4},"status":"keep","description":"Derive profile fallback copy from fallback mode metadata","timestamp":1779232522124,"segment":0,"confidence":4.043771043771044,"asi":{"hypothesis":"Profile cloud-forbid fallback copy should derive from the shared fallback mode metadata, so changing the fallback mode cannot leave user-facing text stale.","learned":"Added profileCloudFallbackMode derived from profileCloudFallbackModeId and changed readiness fallback reason to interpolate profileCloudFallbackMode.label instead of hard-coding Local balanced in the string.","privacy_boundary":"Only local routing/status copy changed; no cloud payloads, credentials, audio, Prompt Pack text, screenshots, transcripts, provider responses, or target content are exposed."}}
{"run":146,"commit":"95272f0","metric":2424,"metrics":{"typecheck_seconds":0.342,"provider_files":12,"cloud_privacy_markers":4},"status":"keep","description":"Guard insertion against empty transcript entries","timestamp":1779232571958,"segment":0,"confidence":4.033500837520938,"asi":{"hypothesis":"Renderer stop/finalize orchestration should verify the returned transcript entry has text before insertion, regardless of provider path, to avoid blank paste/insert operations if a backend regresses.","learned":"stopAndTranscribe now checks entry.text.trim() after local/file-cloud/realtime finalization and throws a clear error before finalizing overlay/insertion if the transcript is empty.","privacy_boundary":"This is local validation of existing transcript text only; no cloud payloads, credentials, audio, Prompt Pack text, screenshots, provider responses, or target content are exposed."}}
{"run":147,"commit":"f268d29","metric":2430,"metrics":{"typecheck_seconds":0.353,"provider_files":12,"cloud_privacy_markers":4},"status":"keep","description":"Fix native helper base64 import scope","timestamp":1779232640784,"segment":0,"confidence":4.023333333333333,"asi":{"hypothesis":"The native helper compile failure is caused by importing BASE64_STANDARD at crate root while realtime PCM chunk emission lives inside the cfg(windows) windows_impl module, so the constant and Engine trait are out of scope there.","learned":"Moved the base64 import into windows_impl as use base64::{prelude::BASE64_STANDARD, Engine as _}; and verified native/windows-helper cargo check passes. The top-level unused import warning is gone.","privacy_boundary":"Compile-scope fix only; realtime PCM chunk payload behavior is unchanged and no logs, credentials, Prompt Pack text, transcripts, screenshots, or target content are exposed."}}
{"run":148,"commit":"pending","metric":2430,"metrics":{"typecheck_seconds":0.349,"provider_files":12,"cloud_privacy_markers":4},"status":"discard","description":"Parse native recording stdout events in order","timestamp":1779232713498,"segment":0,"confidence":4.003316749585406,"asi":{"hypothesis":"WindowsHelperService should parse recordingLevel and realtimePcm16Chunk stdout events in source order instead of pairing separate level/chunk arrays by index, avoiding accidental mismatch if helper event cadence changes.","learned":"Implemented ordered parseRecordingStdoutEvents and typecheck passed, but the primary score was unchanged.","rollback_reason":"Primary metric unchanged; autoresearch rules require discard.","next_action_hint":"Reapply only if paired with a distinct acceptance marker or a concrete bug report around level/chunk mismatch; otherwise keep focus on higher-impact cloud acceptance gaps."}}
{"run":149,"commit":"c49ef79","metric":2442,"metrics":{"typecheck_seconds":0.345,"provider_files":12,"cloud_privacy_markers":4},"status":"keep","description":"Parse native recording stdout events in order","timestamp":1779232783874,"segment":0,"confidence":4.003300330033003,"asi":{"hypothesis":"WindowsHelperService should parse recordingLevel and realtimePcm16Chunk stdout events in source order instead of pairing separate level/chunk arrays by index, avoiding accidental mismatch if helper event cadence changes.","learned":"Added ordered parseRecordingStdoutEvents, route stdout events through it, and removed parseRealtimePcm16ChunkEvents. The parser emits level events and validated 24 kHz mono PCM16 chunk events in their original stdout order.","privacy_boundary":"This only changes local helper event parsing; PCM chunks are still forwarded only to an already-gated active realtime session and are not saved or logged."}}
