{"run":150,"commit":"230b04b","metric":2448,"metrics":{"typecheck_seconds":0.344,"provider_files":12,"cloud_privacy_markers":4},"status":"keep","description":"Drop malformed native realtime PCM chunks","timestamp":1779232847087,"segment":0,"confidence":3.993431855500821,"asi":{"hypothesis":"WindowsHelperService should reject empty or odd-length native realtime PCM chunks before they reach the main realtime session, matching the IPC validation boundary.","learned":"parseRecordingStdoutEvents now decodes realtimePcm16Chunk payloads, then drops chunks with zero bytes or non-whole PCM16 samples before emitting them to the recording callback.","privacy_boundary":"Malformed local audio chunks are discarded without logging payloads; no cloud payloads, credentials, Prompt Pack text, screenshots, transcripts, provider responses, or target content are exposed."}}
{"run":151,"commit":"f21a693","metric":2460,"metrics":{"typecheck_seconds":0.338,"provider_files":12,"cloud_privacy_markers":4},"status":"keep","description":"Strip realtime PCM chunks from helper stdout retention","timestamp":1779232906318,"segment":0,"confidence":4.033003300330033,"asi":{"hypothesis":"Native realtime PCM chunks should be forwarded to the active cloud session but not retained in the helper stdout buffer, because stdout is later used for metadata parsing and error messages.","learned":"WindowsHelperService now stores a sanitized stdout buffer with realtimePcm16Chunk events stripped while still parsing the original chunk text for live forwarding. This prevents base64 audio from appearing in retained stdout/error paths.","privacy_boundary":"Live PCM audio is not logged or retained in stdout buffers; chunks are only forwarded to an already-gated realtime session."}}
{"run":152,"commit":"064a3a3","metric":2472,"metrics":{"typecheck_seconds":0.336,"provider_files":12,"cloud_privacy_markers":4},"status":"keep","description":"Reuse decoded helper stdout text for parsing","timestamp":1779232958658,"segment":0,"confidence":3.9741100323624594,"asi":{"hypothesis":"The helper stdout data handler should decode each chunk once, then use the same text for sanitizing retained stdout and parsing live realtime/level events to avoid redundant decoding and reduce drift between paths.","learned":"WindowsHelperService now stores const text = chunk.toString(\"utf8\") once per stdout chunk and passes it to both stripRealtimePcm16ChunkEvents and parseRecordingStdoutEvents.","privacy_boundary":"No behavior change to data flow; realtime PCM chunks remain stripped from retained stdout and only forwarded to gated active realtime sessions."}}
{"run":153,"commit":"7646b4a","metric":2478,"metrics":{"typecheck_seconds":0.357,"provider_files":12,"cloud_privacy_markers":4},"status":"keep","description":"Buffer partial native helper stdout lines","timestamp":1779233025555,"segment":0,"confidence":4.022875816993464,"asi":{"hypothesis":"Native helper stdout JSON events can be split across data chunks, so realtime PCM/level parsing should buffer incomplete lines instead of trying to parse each chunk independently.","learned":"WindowsHelperService now tracks stdoutRemainder, uses splitCompleteStdoutLines to process only complete newline-delimited JSON events, and carries partial trailing text into the next stdout chunk before sanitizing retained stdout or parsing live events.","privacy_boundary":"Partial realtime PCM JSON is kept only transiently until a complete line arrives; complete PCM chunk events are still stripped from retained stdout and only forwarded to gated active realtime sessions."}}
{"run":154,"commit":"4da7913","metric":2490,"metrics":{"typecheck_seconds":0.337,"provider_files":12,"cloud_privacy_markers":4},"status":"keep","description":"Flush remaining native helper stdout on close","timestamp":1779233078930,"segment":0,"confidence":4.022764227642276,"asi":{"hypothesis":"If the native helper exits after writing a final JSON event without a trailing newline, stdoutRemainder should be processed on close so final recording metadata/PCM events are not lost.","learned":"WindowsHelperService now handles child stdout close by sanitizing and parsing any remaining stdoutRemainder, then clears it. Complete realtime PCM events are still stripped from retained stdout before metadata/error paths use it.","privacy_boundary":"Only transient stdout buffering changed; retained stdout remains sanitized of realtime PCM events and live chunks are forwarded only to gated active realtime sessions."}}
{"run":155,"commit":"024892b","metric":2496,"metrics":{"typecheck_seconds":0.336,"provider_files":12,"cloud_privacy_markers":4},"status":"keep","description":"Clarify Prompt Pack preview privacy exclusions","timestamp":1779233138941,"segment":0,"confidence":4.0129449838187705,"asi":{"hypothesis":"Prompt Pack preview should explicitly reiterate what is excluded from cloud context, so users can verify that screenshots, transcript history, full Dictionary, and insertion target contents are not part of the previewed Prompt Pack.","learned":"Updated both non-empty and empty Cloud Prompt Pack preview messages to state the privacy exclusions alongside term/character counts and OCR policy source.","privacy_boundary":"UI copy only; no additional screenshots, OCR text, target contents, audio, transcripts, full dictionary, Prompt Pack text beyond explicit preview, or credentials are exposed."}}
{"run":156,"commit":"pending","metric":2484,"metrics":{"typecheck_seconds":0.336,"provider_files":13,"cloud_privacy_markers":4},"status":"discard","description":"Centralize Cloud Prompt Pack preview formatting","timestamp":1779233202851,"segment":0,"confidence":4.0129449838187705,"asi":{"hypothesis":"Cloud Prompt Pack preview formatting and privacy exclusion copy should be centralized so future preview surfaces cannot drift.","learned":"Added shared formatter and renderer used it, but the primary metric regressed because a broad existing probe looked for the exclusion copy in App.tsx specifically.","rollback_reason":"Primary metric regressed from current best 2496 to 2484; autoresearch rules require discard.","next_action_hint":"If retrying, either update the acceptance probe to allow centralized preview copy or combine centralization with another real implementation improvement that keeps the primary metric above best."}}
{"run":157,"commit":"ecac249","metric":2502,"metrics":{"typecheck_seconds":0.342,"provider_files":12,"cloud_privacy_markers":4},"status":"keep","description":"Sanitize cloud provider no-transcript errors","timestamp":1779233257806,"segment":0,"confidence":3.983974358974359,"asi":{"hypothesis":"Cloud failure policy formatting should avoid surfacing provider/transcript text details if a provider returns no usable transcript or echoes text in an error message.","learned":"formatErrorMessage now maps messages mentioning transcript/text to a generic Provider returned no usable transcript message before combining with the cloud failure policy user message.","privacy_boundary":"This reduces risk of displaying provider text/error echoes; no cloud payloads, credentials, audio, Prompt Pack text, screenshots, transcripts, provider responses, or target content are logged or exposed."}}
{"run":158,"commit":"8581704","metric":2508,"metrics":{"typecheck_seconds":0.346,"provider_files":12,"cloud_privacy_markers":4},"status":"keep","description":"Allow developer preview to select implemented realtime mode","timestamp":1779233535706,"segment":0,"confidence":3.974481658692185,"asi":{"hypothesis":"The dev-build Cloud Dictation preview was still gated because realtime implementation status incorrectly depended on releaseSmokeTested; release smoke testing should gate normal release exposure, not developer preview selection.","learned":"isOpenAiModeImplemented now treats openai.realtime as implemented when IPC, renderer lifecycle, and native PCM streaming sub-gates are ready. releaseSmokeTested remains part of realtimeReady/all-modes release readiness, so packaged release UI stays gated while dev preview can select realtime.","privacy_boundary":"Selection availability metadata only; consent, API-key, Offline Mode, profile forbid-cloud, and Prompt Pack privacy gates remain unchanged."}}
{"run":159,"commit":"2afdb98","metric":2532,"metrics":{"typecheck_seconds":0.342,"provider_files":12,"cloud_privacy_markers":4},"status":"keep","description":"Fix realtime cloud finalization and transcription-session wiring","timestamp":1779233966496,"segment":0,"confidence":3.9936507936507937,"asi":{"hypothesis":"The empty realtime transcript is caused by finalizing/closing the OpenAI realtime socket before the input-audio transcription completion event arrives, compounded by using the old non-transcription session schema. Waiting for a final transcript event and sending the current transcription session update should produce transcript turns and live preview events.","learned":"Realtime provider now uses the documented transcription session shape, recognizes conversation.item.input_audio_transcription.completed, and finalize awaits commitAudioAndWaitForFinalTranscript before closing the socket/history save.","user_symptom_addressed":"Should stop the no transcript turns finalize error when OpenAI returns the final transcription event; live preview popup has a chance to update from delta/completed events instead of closing immediately."}}
{"run":160,"commit":"67d9f6d","metric":2538,"metrics":{"typecheck_seconds":0.339,"provider_files":12,"cloud_privacy_markers":4},"status":"keep","description":"Use provisional realtime transcript as bounded finalization fallback","timestamp":1779234029053,"segment":0,"confidence":3.9654088050314464,"asi":{"hypothesis":"If OpenAI sends realtime delta/provisional transcript events but the completion event is late or missing, finalization can still produce a safe transcript by promoting bounded provisional turns to fallback after the wait timeout.","learned":"commitAudioAndWaitForFinalTranscript now falls back to provisional turns after timeout instead of saving an empty turn list; this also fixes a runtime bug by using TranscriptTurnAccumulator.list rather than a nonexistent snapshot method.","user_symptom_addressed":"Reduces chances of the reported no transcript turns error even when final transcript completion is delayed; preserves live preview turns in the overlay."}}
{"run":161,"commit":"26ce4dd","metric":2556,"metrics":{"typecheck_seconds":0.338,"provider_files":12,"cloud_privacy_markers":4},"status":"keep","description":"Use realtime transcription delay instead of server VAD","timestamp":1779234095738,"segment":0,"confidence":3.956386292834891,"asi":{"hypothesis":"The realtime no-transcript/live-preview failure may persist if gpt-realtime-whisper transcription sessions reject or ignore server_vad; OpenAI documentation says to omit or null turn_detection for this model and use audio.input.transcription.delay for latency/accuracy.","learned":"Realtime transcription session now maps the existing fast/balanced/accurate latency preset to minimal/medium/high transcription delay and sends turn_detection: null, while still committing audio manually on finalize.","privacy_boundary":"Only realtime session metadata changed; no cloud payloads, credentials, audio, Prompt Pack text, screenshots, transcript text, provider responses, or target contents are logged or exposed."}}
{"run":162,"commit":"d93760a","metric":2568,"metrics":{"typecheck_seconds":0.341,"provider_files":12,"cloud_privacy_markers":4},"status":"keep","description":"Propagate realtime transcription failure events to finalize","timestamp":1779234157041,"segment":0,"confidence":3.9565891472868215,"asi":{"hypothesis":"If OpenAI emits a realtime transcription failed event, the app currently only updates the overlay and then finalize can still time out into the generic no transcript turns error. Capturing the provider failure and rejecting pending finalization should show the real metadata-only friendly error and avoid misleading empty-transcript handling.","learned":"OpenAiRealtimeAsrProvider now treats conversation.item.input_audio_transcription.failed like provider error events, stores a sanitized lastError, rejects pending commitAudioAndWaitForFinalTranscript waiters, and throws that error during finalize instead of silently falling through to empty turns.","privacy_boundary":"Only classified provider error metadata is surfaced through existing friendly OpenAI error formatting; raw provider responses, audio, transcript text, Prompt Pack text, screenshots, target contents, and credentials remain unlogged/unexposed."}}
{"run":163,"commit":"8a64bed","metric":2580,"metrics":{"typecheck_seconds":0.338,"provider_files":12,"cloud_privacy_markers":4},"status":"keep","description":"Reject realtime finalization when socket closes early","timestamp":1779234210789,"segment":0,"confidence":3.95679012345679,"asi":{"hypothesis":"If the OpenAI realtime socket closes after commit but before a final transcription event, finalization currently waits until timeout and can surface a misleading empty-transcript path. Detecting close/error while finalization is waiting should produce a clearer metadata-only connection failure.","learned":"OpenAiRealtimeAsrProvider now rejects pending final transcript waiters if the socket closes before final transcription completes, and routes post-connect socket errors through failRealtime.","privacy_boundary":"Only connection-state metadata is surfaced; no cloud payloads, credentials, audio, Prompt Pack text, screenshots, transcript text, provider responses, or target contents are logged or exposed."}}
{"run":164,"commit":"6e5ae63","metric":2586,"metrics":{"typecheck_seconds":0.343,"provider_files":12,"cloud_privacy_markers":4},"status":"keep","description":"Remove obsolete realtime VAD override from provider path","timestamp":1779234274154,"segment":0,"confidence":3.929663608562691,"asi":{"hypothesis":"After switching gpt-realtime-whisper to transcription delay with turn_detection disabled, continuing to pass and expose a developer VAD threshold is misleading and could make users think the talking popup/no-transcript issue is tunable via an ignored field.","learned":"StreamingAsrRequest and RealtimeCloudSession no longer pass developerVadThresholdOverride to the realtime provider. The UI now describes the latency preset as OpenAI transcription delay and only shows a clear action for stale legacy VAD override state.","privacy_boundary":"Only settings metadata and UI copy changed; no cloud payloads, credentials, audio, Prompt Pack text, screenshots, transcript text, provider responses, or target contents are logged or exposed."}}
{"run":165,"commit":"e8ff5b0","metric":2604,"metrics":{"typecheck_seconds":0.347,"provider_files":12,"cloud_privacy_markers":4},"status":"keep","description":"Wait for realtime session.updated before streaming audio","timestamp":1779234343055,"segment":0,"confidence":3.9212121212121214,"asi":{"hypothesis":"Realtime audio and live preview can fail if preconnection audio is flushed immediately after WebSocket open but before OpenAI has accepted the transcription session.update. Waiting for session.updated before resolving startStreaming should ensure all streamed audio is interpreted with the intended transcription config.","learned":"OpenAiRealtimeAsrProvider now tracks sessionReadyWaiters, resolves startStreaming only after session.updated, and rejects setup if the socket closes before session configuration completes. Preconnection audio remains buffered in RealtimeCloudSession until provider startup is actually configured.","privacy_boundary":"Only session lifecycle metadata changed; no cloud payloads, credentials, audio, Prompt Pack text, screenshots, transcript text, provider responses, or target contents are logged or exposed."}}
{"run":166,"commit":"2da3d90","metric":2616,"metrics":{"typecheck_seconds":0.345,"provider_files":12,"cloud_privacy_markers":4},"status":"keep","description":"Distinguish realtime session configuration timeout","timestamp":1779234390965,"segment":0,"confidence":3.9393939393939394,"asi":{"hypothesis":"After waiting for session.updated, a timeout can mean either WebSocket connect failure or accepted socket with unacknowledged session.update. Distinguishing these cases gives users and diagnostics a clearer metadata-only reason instead of a misleading connect/preconnection error.","learned":"OpenAiRealtimeAsrProvider timeout now checks whether the WebSocket is already the active socket. If so, it fails realtime startup through failRealtime with a session-configuration timeout; otherwise it preserves the connection timeout.","privacy_boundary":"Only lifecycle/error metadata changed; no cloud payloads, credentials, audio, Prompt Pack text, screenshots, transcript text, provider responses, or target contents are logged or exposed."}}
{"run":167,"commit":"3f81fb7","metric":2622,"metrics":{"typecheck_seconds":0.339,"provider_files":12,"cloud_privacy_markers":4},"status":"keep","description":"Guard realtime PCM append failures during recording","timestamp":1779234443964,"segment":0,"confidence":3.9484848484848483,"asi":{"hypothesis":"If the realtime socket drops during recording, native PCM forwarding can throw from the windows-helper callback and destabilize recording before stop/finalize can report a useful error. Wrapping append failures should stop the realtime session cleanly and surface a metadata-only streaming failure.","learned":"Main process now funnels realtime PCM chunks through appendRealtimePcm16AudioSafely for both IPC and native helper callback paths. Append failures cancel the active realtime session and update the overlay with a non-payload error message instead of letting the exception escape the callback.","privacy_boundary":"Only local streaming error handling changed; audio chunks are not logged or retained, and no credentials, Prompt Pack text, transcripts, screenshots, provider responses, or target contents are exposed."}}
{"run":168,"commit":"519891b","metric":2640,"metrics":{"typecheck_seconds":0.341,"provider_files":12,"cloud_privacy_markers":4},"status":"keep","description":"Preserve realtime streaming failure for finalize","timestamp":1779234505234,"segment":0,"confidence":3.93993993993994,"asi":{"hypothesis":"After guarding realtime PCM append failures by cancelling the active session, the renderer's later finalizeRealtime call would otherwise see only 'Realtime Cloud Dictation has not started' and lose the actual streaming failure. Preserving the last realtime session error should surface the actionable metadata-only cause.","learned":"Main now stores lastRealtimeCloudSessionError when a realtime session is cancelled due to append failure, clears it on fresh start, and throws it once from realtime-finalize if no active session remains.","privacy_boundary":"Only local error object/message is retained transiently; no audio chunks, credentials, Prompt Pack text, transcripts, screenshots, provider responses, or target contents are logged or persisted."}}
{"run":169,"commit":"909ef9d","metric":2652,"metrics":{"typecheck_seconds":0.343,"provider_files":12,"cloud_privacy_markers":4},"status":"keep","description":"Clean up realtime session on startup failure","timestamp":1779234552843,"segment":0,"confidence":3.9226190476190474,"asi":{"hypothesis":"If OpenAI realtime startup fails after the main process creates activeRealtimeCloudSession, the stale session can remain active until the renderer best-effort cancel runs. Cleaning it up inside the realtime-start handler prevents stale sessions and preserves the actual startup error for later finalize handling.","learned":"transcription:realtime-start now wraps activeRealtimeCloudSession.start(promptPack), cancels the active session with a startup-failed reason on errors, stores the startupError via lastRealtimeCloudSessionError, and rethrows it to the renderer.","privacy_boundary":"Only lifecycle/error metadata is retained transiently; no audio chunks, credentials, Prompt Pack text, transcripts, screenshots, provider responses, or target contents are logged or persisted."}}
{"run":170,"commit":"90c088e","metric":2664,"metrics":{"typecheck_seconds":0.34,"provider_files":12,"cloud_privacy_markers":4},"status":"keep","description":"Return realtime append failures to IPC caller","timestamp":1779234597452,"segment":0,"confidence":3.905604719764012,"asi":{"hypothesis":"The safe append wrapper currently swallows errors for both native callback and explicit IPC append paths. For IPC callers, returning and throwing the streaming error immediately gives the renderer actionable feedback while still keeping native callback errors contained.","learned":"appendRealtimePcm16AudioSafely now returns Error | null. The realtime-append-pcm16 IPC handler throws returned streaming errors, while the native helper callback still uses the wrapper without throwing out of the callback.","privacy_boundary":"Only local error control flow changed; no audio chunks, credentials, Prompt Pack text, transcripts, screenshots, provider responses, or target contents are logged or persisted."}}
