{"run":102,"commit":"e298117","metric":1848,"metrics":{"typecheck_seconds":0.338,"provider_files":11,"cloud_privacy_markers":4},"status":"keep","description":"Centralize realtime cloud session cancellation","timestamp":1779229955623,"segment":0,"confidence":4.33096926713948,"asi":{"hypothesis":"Realtime cloud session cleanup should be centralized and invoked on app shutdown so OpenAI sockets cannot survive replacement, explicit cancel, or VoxType quit paths.","learned":"Added cancelActiveRealtimeCloudSession helper, reused it for new-session replacement and realtime-cancel IPC, and call it from will-quit with a shutdown-specific reason before other teardown.","privacy_boundary":"This closes/clears cloud session state and does not send additional audio, Prompt Pack text, transcripts, screenshots, credentials, or target content."}}
{"run":103,"commit":"4d14a2f","metric":1872,"metrics":{"typecheck_seconds":0.341,"provider_files":11,"cloud_privacy_markers":4},"status":"keep","description":"Wire renderer realtime cloud session lifecycle","timestamp":1779230038297,"segment":0,"confidence":4.419047619047619,"asi":{"hypothesis":"Renderer recording orchestration should enter the realtime Cloud Dictation session lifecycle when readiness resolves to openai.realtime, rather than routing the stop path through completed-WAV transcription.","learned":"startRecording now starts the main-process realtime session for openai.realtime, cancels it if recorder startup fails, and stopAndTranscribe finalizes realtime sessions through finalizeRealtime with realtime-specific finalizing copy while keeping file/local modes on transcribeWav.","privacy_boundary":"Realtime still uses existing readiness gates and capped Prompt Pack construction; this change does not add screenshots, transcript history, full dictionary, target content, or credential exposure."}}
{"run":104,"commit":"b326dbd","metric":1884,"metrics":{"typecheck_seconds":0.297,"provider_files":11,"cloud_privacy_markers":4},"status":"keep","description":"Add native recorder hook for realtime PCM forwarding","timestamp":1779230098250,"segment":0,"confidence":4.384976525821596,"asi":{"hypothesis":"Realtime Cloud Dictation needs the native recorder path to support forwarding PCM16 chunks to the active main-process realtime session as soon as streaming output becomes available.","learned":"WindowsHelperService recording level callback now accepts an optional pcm16Chunk, main recording orchestration forwards chunks to activeRealtimeCloudSession.appendPcm16Audio, and an explicit extractRealtimePcm16Chunk placeholder marks the native-helper integration seam.","privacy_boundary":"No audio is forwarded yet because native helper streaming chunks are not emitted; the hook only forwards chunks when present and only to an already gated active realtime session."}}
{"run":105,"commit":"5309bc4","metric":1908,"metrics":{"typecheck_seconds":0.339,"provider_files":11,"cloud_privacy_markers":4},"status":"keep","description":"Buffer realtime audio before OpenAI session connects","timestamp":1779230149184,"segment":0,"confidence":4.37962962962963,"asi":{"hypothesis":"Realtime Cloud Dictation should tolerate microphone audio arriving before the OpenAI WebSocket is ready by keeping only the allowed short pre-connection PCM buffer and flushing it after connection.","learned":"RealtimeCloudSession now buffers pre-connection PCM16 chunks up to 5 seconds at 24 kHz mono, ignores appends after finalization, marks streamingStarted after provider start, and flushes buffered chunks to OpenAI once connected.","privacy_boundary":"The buffer is bounded to the PRD pre-connection window and exists only in memory for an active, consent/API-key-gated realtime session; no audio is stored or logged."}}
{"run":106,"commit":"548ccc2","metric":1920,"metrics":{"typecheck_seconds":0.352,"provider_files":11,"cloud_privacy_markers":4},"status":"keep","description":"Report dropped realtime pre-connection audio","timestamp":1779230189453,"segment":0,"confidence":4.377011494252874,"asi":{"hypothesis":"If the realtime pre-connection buffer overflows, users should be told that oldest audio was dropped rather than silently losing speech before OpenAI connects.","learned":"RealtimeCloudSession now tracks preConnectionDroppedBytes when the 5-second buffer evicts chunks. Finalization surfaces a metadata-only overlay warning if any pre-connection audio was dropped.","privacy_boundary":"Only byte counts and warning text are tracked; no audio, transcripts, Prompt Pack text, screenshots, credentials, or target content are logged or persisted."}}
{"run":107,"commit":"2cbf4e5","metric":1938,"metrics":{"typecheck_seconds":0.344,"provider_files":11,"cloud_privacy_markers":4},"status":"keep","description":"Cancel realtime cloud session on stop-path failures","timestamp":1779230236748,"segment":0,"confidence":4.328828828828829,"asi":{"hypothesis":"Realtime Cloud Dictation stop handling should cancel the main-process session if VAD detects no speech or finalization fails, preventing stale sockets/session state after stop-path errors.","learned":"stopAndTranscribe now tracks the resolved readiness mode, cancels realtime sessions when no speech is detected, and cancels realtime sessions if finalization/transcription throws before cleanup completes.","privacy_boundary":"This only closes cloud session state on error paths and sends no extra audio, Prompt Pack text, transcripts, screenshots, credentials, or target content."}}
{"run":108,"commit":"839430e","metric":1950,"metrics":{"typecheck_seconds":0.359,"provider_files":11,"cloud_privacy_markers":4},"status":"keep","description":"Show provider-specific stop busy messages","timestamp":1779230277544,"segment":0,"confidence":4.32662192393736,"asi":{"hypothesis":"The stop path should not briefly tell users that cloud or realtime dictation is transcribing locally; status text should be based on resolved readiness mode.","learned":"stopAndTranscribe now waits for readiness, tracks the resolved mode, and sets busy text to Finalizing realtime cloud dictation, Transcribing with OpenAI, or Transcribing locally as appropriate.","privacy_boundary":"Only local UI status text changed; no provider calls, audio, Prompt Pack text, transcripts, screenshots, credentials, or target content handling changed."}}
{"run":109,"commit":"ee0e9df","metric":1962,"metrics":{"typecheck_seconds":0.341,"provider_files":11,"cloud_privacy_markers":4},"status":"keep","description":"Reject empty realtime cloud history entries","timestamp":1779230318401,"segment":0,"confidence":4.3244444444444445,"asi":{"hypothesis":"Realtime Cloud Dictation finalization should not save a blank history entry when OpenAI returns no usable transcript turns.","learned":"RealtimeCloudHistoryService now composes provider turns before applying corrections and throws a clear error if the composed text is empty, preventing empty realtime entries from being persisted.","privacy_boundary":"The check uses only in-memory transcript turn text already needed for final insertion/history; it adds no logging, provider calls, audio storage, screenshots, credentials, Prompt Pack text, or target content."}}
{"run":110,"commit":"b168680","metric":1968,"metrics":{"typecheck_seconds":0.339,"provider_files":11,"cloud_privacy_markers":4},"status":"keep","description":"Surface realtime finalization failures in overlay","timestamp":1779230357895,"segment":0,"confidence":4.337777777777778,"asi":{"hypothesis":"If realtime history/finalization fails after the session is stopped, the overlay should show a concise failure state instead of only propagating the renderer error.","learned":"transcription:realtime-finalize now wraps RealtimeCloudHistoryService.save, updates the overlay with a Cloud Dictation finalizing failure message on error, and rethrows for renderer cleanup/error handling.","privacy_boundary":"Only friendly local error text is surfaced; no raw provider responses, transcript text, audio, Prompt Pack text, screenshots, credentials, or target content are logged or exposed."}}
{"run":111,"commit":"c0db0ea","metric":1980,"metrics":{"typecheck_seconds":0.335,"provider_files":11,"cloud_privacy_markers":4},"status":"keep","description":"Validate realtime PCM append chunks","timestamp":1779230399414,"segment":0,"confidence":4.364444444444445,"asi":{"hypothesis":"Realtime Cloud Dictation IPC should reject malformed audio append payloads before they reach the OpenAI realtime provider.","learned":"transcription:realtime-append-pcm16 now requires a non-empty Uint8Array and rejects odd byte counts so PCM16 chunks always contain whole 16-bit samples before forwarding to the active session.","privacy_boundary":"This is local input validation only; it prevents malformed audio forwarding and does not log or expose audio, transcripts, Prompt Pack text, screenshots, credentials, or target content."}}
{"run":112,"commit":"fd6bd39","metric":1998,"metrics":{"typecheck_seconds":0.346,"provider_files":11,"cloud_privacy_markers":4},"status":"keep","description":"Track realtime readiness sub-gates","timestamp":1779230441077,"segment":0,"confidence":4.29004329004329,"asi":{"hypothesis":"OpenAI release gating should expose why realtime is still not release-ready now that IPC and renderer lifecycle are implemented but native PCM streaming remains incomplete.","learned":"OpenAiModeImplementationReadiness now tracks realtimeSessionIpcReady, realtimeRendererLifecycleReady, and realtimeNativePcmStreamingReady separately. Current readiness marks IPC and renderer lifecycle ready while keeping native PCM streaming and overall realtime release readiness false.","privacy_boundary":"Readiness metadata only; Cloud Dictation remains release-gated and no cloud payload, credential, audio, transcript, Prompt Pack, screenshot, or target content handling changed."}}
{"run":113,"commit":"cbe948f","metric":2010,"metrics":{"typecheck_seconds":0.344,"provider_files":11,"cloud_privacy_markers":4},"status":"keep","description":"Show realtime readiness sub-gates in settings","timestamp":1779230478752,"segment":0,"confidence":4.316017316017316,"asi":{"hypothesis":"Developer/release settings should display the realtime readiness sub-gates so users/testers understand why Cloud Dictation remains release-gated despite partial realtime wiring.","learned":"Settings now shows a realtime readiness note with IPC, renderer lifecycle, and native PCM streaming ready/pending states from currentOpenAiModeImplementationReadiness.","privacy_boundary":"Only capability metadata is displayed; no cloud payloads, credentials, audio, transcripts, Prompt Pack text, screenshots, or target content are exposed."}}
{"run":114,"commit":"b7e705b","metric":2022,"metrics":{"typecheck_seconds":0.34,"provider_files":11,"cloud_privacy_markers":4},"status":"keep","description":"Explain realtime mode implementation blocker","timestamp":1779230524492,"segment":0,"confidence":4.286324786324786,"asi":{"hypothesis":"Mode availability should report the concrete realtime implementation blocker, not a generic not-implemented message, now that realtime has multiple readiness sub-gates.","learned":"Added getOpenAiModeImplementationStatus to map realtime readiness sub-gates to a user-facing implementation reason. Dictation mode availability now uses that status and reports that native PCM streaming is not implemented yet for realtime.","privacy_boundary":"Only local capability metadata/copy changed; Cloud Dictation remains gated and no cloud data, credentials, audio, Prompt Pack text, screenshots, transcripts, or target content flow changed."}}
{"run":115,"commit":"58bd809","metric":2028,"metrics":{"typecheck_seconds":0.34,"provider_files":11,"cloud_privacy_markers":4},"status":"keep","description":"Derive realtime release readiness from sub-gates","timestamp":1779230723935,"segment":0,"confidence":4.299145299145299,"asi":{"hypothesis":"Realtime release readiness should be derived from its implementation sub-gates so the release gate cannot drift from IPC, renderer lifecycle, and native PCM streaming status.","learned":"Added createOpenAiModeImplementationReadiness, which computes realtimeReady from realtimeSessionIpcReady, realtimeRendererLifecycleReady, and realtimeNativePcmStreamingReady. Current readiness now uses the helper, keeping realtime release readiness false until all sub-gates are true.","privacy_boundary":"Readiness metadata only; no cloud payloads, credentials, audio, Prompt Pack text, screenshots, transcripts, or target content handling changed."}}
{"run":116,"commit":"1228dc1","metric":2052,"metrics":{"typecheck_seconds":0.344,"provider_files":11,"cloud_privacy_markers":4},"status":"keep","description":"Emit realtime PCM16 chunks from native helper","timestamp":1779230829400,"segment":0,"confidence":4.29535864978903,"asi":{"hypothesis":"The native Windows helper should emit provider-ready 24 kHz mono PCM16 chunks during recording so the Electron realtime path can forward live audio to OpenAI without waiting for the completed WAV.","learned":"Added base64 dependency and realtimePcm16Chunk JSON events in the helper. Resampled 24 kHz mono float chunks are converted to little-endian PCM16, base64-encoded, and emitted on stdout alongside level events before VAD trimming/history saving.","privacy_boundary":"This emits live microphone audio only on the already-started local helper stdout path; it does not store realtime audio, log provider responses, or include screenshots, transcript history, full dictionary, target contents, Prompt Pack text, or credentials."}}
{"run":117,"commit":"999c6fa","metric":2058,"metrics":{"typecheck_seconds":0.348,"provider_files":11,"cloud_privacy_markers":4},"status":"keep","description":"Forward native realtime PCM chunks to OpenAI session","timestamp":1779230879071,"segment":0,"confidence":4.254166666666666,"asi":{"hypothesis":"Now that the native helper emits realtimePcm16Chunk events, the main helper service should parse and forward those PCM16 chunks to the active realtime OpenAI session, completing native PCM streaming readiness.","learned":"WindowsHelperService now parses realtimePcm16Chunk JSON events, validates pcm16/24kHz/mono metadata, decodes base64 audio to Uint8Array chunks, and passes them through the recording callback. OpenAI readiness now marks realtimeNativePcmStreamingReady true, which derives realtimeReady true.","privacy_boundary":"Only live microphone PCM chunks from an active recording are forwarded to an already-gated realtime session; chunks are not saved or logged and no screenshots, transcript history, full dictionary, target contents, Prompt Pack text, or credentials are exposed."}}
{"run":118,"commit":"2a9e34c","metric":2076,"metrics":{"typecheck_seconds":0.343,"provider_files":11,"cloud_privacy_markers":4},"status":"keep","description":"Keep cloud release gated pending smoke testing","timestamp":1779230926685,"segment":0,"confidence":4.265010351966874,"asi":{"hypothesis":"Even after wiring native PCM streaming, normal release UI should stay gated until end-to-end Cloud Dictation has been smoke-tested, avoiding premature exposure of newly wired realtime behavior.","learned":"Added releaseSmokeTested as a final OpenAI readiness gate. RealtimeReady and all-modes release readiness now require it, and realtime availability reports a concrete smoke-testing blocker while developer preview remains available in developer builds.","privacy_boundary":"Readiness metadata only; no cloud payloads, credentials, audio, Prompt Pack text, screenshots, transcripts, or target content handling changed."}}
{"run":119,"commit":"d5f028e","metric":2082,"metrics":{"typecheck_seconds":0.336,"provider_files":11,"cloud_privacy_markers":4},"status":"keep","description":"Show release smoke-test readiness in settings","timestamp":1779230967180,"segment":0,"confidence":4.251028806584362,"asi":{"hypothesis":"Since release smoke testing is now the remaining cloud release gate, Settings should show that sub-gate alongside realtime implementation readiness.","learned":"The realtime readiness note now includes release smoke test ready/pending status, making it clear why release Cloud Dictation remains gated after IPC, renderer lifecycle, and native PCM streaming are ready.","privacy_boundary":"Only capability metadata is displayed; no cloud payloads, credentials, audio, Prompt Pack text, screenshots, transcripts, or target content are exposed."}}
{"run":120,"commit":"4f6bf9d","metric":2100,"metrics":{"typecheck_seconds":0.339,"provider_files":11,"cloud_privacy_markers":4},"status":"keep","description":"Define cloud release smoke-test checklist","timestamp":1779231011835,"segment":0,"confidence":4.261758691206544,"asi":{"hypothesis":"The release smoke-test gate should be backed by an explicit checklist, not a bare boolean, so future release enablement is reviewable and hard to accidentally flip.","learned":"Added shared CloudReleaseSmokeTestChecklist with required smoke-test items for realtime, file modes, Offline Mode kill switch, profile fallback, and sensitive-log checks. releaseSmokeTested is now derived from isCloudReleaseSmokeTestComplete(currentCloudReleaseSmokeTestChecklist).","privacy_boundary":"Checklist metadata only; no cloud payloads, credentials, audio, Prompt Pack text, screenshots, transcripts, or target content handling changed."}}
{"run":121,"commit":"04080c8","metric":2118,"metrics":{"typecheck_seconds":0.346,"provider_files":11,"cloud_privacy_markers":4},"status":"keep","description":"Display pending cloud smoke-test items","timestamp":1779231083278,"segment":0,"confidence":4.272357723577236,"asi":{"hypothesis":"The release smoke-test gate should show which checklist items remain pending, not just that the gate is pending, so release readiness is actionable.","learned":"Added getPendingCloudReleaseSmokeTests and formatCloudReleaseSmokeTestStatus. Settings now displays the pending smoke-test checklist item keys alongside realtime readiness status.","privacy_boundary":"Only local readiness/checklist metadata is displayed; no cloud payloads, credentials, audio, Prompt Pack text, screenshots, transcripts, or target content are exposed."}}
{"run":122,"commit":"39d4220","metric":2136,"metrics":{"typecheck_seconds":0.346,"provider_files":11,"cloud_privacy_markers":4},"status":"keep","description":"Use readable cloud smoke-test labels","timestamp":1779231121878,"segment":0,"confidence":4.257028112449799,"asi":{"hypothesis":"Pending release smoke-test status should use reviewer-readable labels rather than internal checklist keys so the remaining gate is understandable in Settings.","learned":"Added cloudReleaseSmokeTestLabels and changed formatCloudReleaseSmokeTestStatus to map pending checklist keys to human-readable labels such as Realtime end-to-end dictation and No sensitive cloud logs.","privacy_boundary":"Only local checklist display text changed; no cloud payloads, credentials, audio, Prompt Pack text, screenshots, transcripts, or target content are exposed."}}
{"run":123,"commit":"563d255","metric":2154,"metrics":{"typecheck_seconds":0.343,"provider_files":11,"cloud_privacy_markers":4},"status":"keep","description":"Assert realtime cloud lifecycle logs are metadata-only","timestamp":1779231169455,"segment":0,"confidence":4.293172690763052,"asi":{"hypothesis":"Realtime Cloud Dictation should use the same metadata-only log guard as file cloud dictation for started, completed, and cancelled lifecycle events.","learned":"RealtimeCloudSession now creates and asserts metadata-only CloudDictationLogEntry objects at start, finalize completion, and cancel paths, including cancelled status, without persisting sensitive fields.","privacy_boundary":"Only provider/model/mode/status/duration metadata is checked; no audio, transcript text, Prompt Pack text, screenshots, credentials, provider responses, or target content is logged."}}
{"run":124,"commit":"967837a","metric":2172,"metrics":{"typecheck_seconds":0.342,"provider_files":11,"cloud_privacy_markers":4},"status":"keep","description":"Cache realtime dictation mode in session","timestamp":1779231228212,"segment":0,"confidence":4.277777777777778,"asi":{"hypothesis":"RealtimeCloudSession should resolve its dictation mode once and reuse it for provider start and lifecycle metadata, avoiding repeated lookups and preventing model/mode drift inside a session.","learned":"RealtimeCloudSession now stores a readonly DictationMode resolved at construction and uses this.mode for startStreaming plus started/completed/cancelled metadata-only log entries.","privacy_boundary":"No cloud payload behavior changed; lifecycle metadata still contains only provider/model/mode/status/duration and no audio, transcripts, Prompt Pack text, screenshots, credentials, provider responses, or target content."}}
{"run":125,"commit":"42bd097","metric":2190,"metrics":{"typecheck_seconds":0.341,"provider_files":11,"cloud_privacy_markers":4},"status":"keep","description":"Expand cloud log sensitive-field guard","timestamp":1779231266768,"segment":0,"confidence":4.313492063492063,"asi":{"hypothesis":"The metadata-only cloud log guard should reject a broader set of sensitive field names before future logging code can accidentally include credentials, raw audio, OCR/image data, or target content.","learned":"Expanded sensitiveKeys to include authorization, bearer, credential, secret, pcm, wav, image, ocr, and targetContent in addition to existing API key/audio/prompt/transcript/screenshot/response terms.","privacy_boundary":"This strengthens local validation of log metadata and does not add any logging or expose cloud payloads, credentials, audio, Prompt Pack text, screenshots, transcripts, OCR text, or target content."}}
