{"run":192,"commit":"ca9f5d0","metric":2868,"metrics":{"typecheck_seconds":0.353,"provider_files":12,"cloud_privacy_markers":4},"status":"keep","description":"Wait for session.updated instead of session.created","timestamp":1779236432929,"segment":0,"confidence":4.169590643274854,"asi":{"hypothesis":"Resolving realtime startup on session.created can flush buffered audio before the client session.update has been accepted, so audio may be interpreted with default realtime settings rather than transcription mode. session.created should be observed but session.updated should remain the startup-ready signal.","learned":"OpenAiRealtimeAsrProvider now records sessionCreatedSeen for lifecycle diagnostics but only resolves session-ready waiters on session.updated after sending the transcription session.update.","privacy_boundary":"Only provider lifecycle metadata is tracked in memory; no provider responses, credentials, audio chunks, Prompt Pack text, transcripts, screenshots, or target contents are logged or persisted."}}
{"run":193,"commit":"b558086","metric":2874,"metrics":{"typecheck_seconds":0.345,"provider_files":12,"cloud_privacy_markers":4},"status":"keep","description":"Distinguish realtime session.update acknowledgement timeout","timestamp":1779236489922,"segment":0,"confidence":4.215339233038348,"asi":{"hypothesis":"After waiting specifically for session.updated, the timeout should distinguish 'no session lifecycle' from 'session.created arrived but our session.update was never acknowledged' so diagnostics point to request-shape/config acceptance rather than generic connection setup.","learned":"OpenAiRealtimeAsrProvider now uses sessionCreatedSeen to emit a distinct timeout message when session.created arrived but session.updated did not before the pre-connection buffer expired.","privacy_boundary":"Only provider lifecycle metadata is used for an in-memory error message; no provider responses, credentials, audio chunks, Prompt Pack text, transcripts, screenshots, or target contents are logged or persisted."}}
{"run":194,"commit":"beedab2","metric":2880,"metrics":{"typecheck_seconds":0.345,"provider_files":12,"cloud_privacy_markers":4},"status":"keep","description":"Reset realtime session-created flag on open","timestamp":1779236537153,"segment":0,"confidence":4.242962962962963,"asi":{"hypothesis":"sessionCreatedSeen is lifecycle state for a single WebSocket startup. Resetting it at the start of openSession prevents stale lifecycle metadata if the provider instance is ever reused after a failed/cancelled startup.","learned":"OpenAiRealtimeAsrProvider.openSession now resets sessionCreatedSeen before creating a new WebSocket and waiting for session.updated.","privacy_boundary":"Only in-memory lifecycle metadata is reset; no provider responses, credentials, audio chunks, Prompt Pack text, transcripts, screenshots, or target contents are logged or persisted."}}
{"run":195,"commit":"b6ee288","metric":2886,"metrics":{"typecheck_seconds":0.352,"provider_files":12,"cloud_privacy_markers":4},"status":"keep","description":"Reset realtime provider error state on open","timestamp":1779236588087,"segment":0,"confidence":4.233038348082596,"asi":{"hypothesis":"lastError is lifecycle state for a single realtime WebSocket attempt. Resetting it at the start of openSession prevents stale provider errors from a prior failed/cancelled attempt affecting a later startup if the provider instance is reused.","learned":"OpenAiRealtimeAsrProvider.openSession now clears lastError alongside sessionCreatedSeen before creating a new WebSocket and waiting for session.updated.","privacy_boundary":"Only in-memory provider error metadata is reset; no provider responses, credentials, audio chunks, Prompt Pack text, transcripts, screenshots, or target contents are logged or persisted."}}
{"run":196,"commit":"9334b59","metric":2892,"metrics":{"typecheck_seconds":0.351,"provider_files":12,"cloud_privacy_markers":4},"status":"keep","description":"Centralize realtime authorization header construction","timestamp":1779236674283,"segment":0,"confidence":4.260740740740741,"asi":{"hypothesis":"The GA realtime WebSocket auth path should keep API-key handling isolated to a small helper so future edits do not accidentally reintroduce beta subprotocol auth or spread credential formatting through session code.","learned":"OpenAiRealtimeAsrProvider now builds the Authorization header through buildOpenAiRealtimeAuthorizationHeader(apiKey), leaving the WebSocket options object to reference the helper instead of interpolating the key inline.","privacy_boundary":"API key remains confined to the WebSocket Authorization header construction path and is not logged or returned; no provider responses, audio chunks, Prompt Pack text, transcripts, screenshots, or target contents are logged or persisted."}}
{"run":197,"commit":"9334b59","metric":2892,"metrics":{"typecheck_seconds":0.349,"provider_files":12,"cloud_privacy_markers":4},"status":"discard","description":"Trim API key when building realtime authorization header","timestamp":1779236739652,"segment":0,"confidence":4.241887905604719,"asi":{"hypothesis":"Realtime WebSocket Authorization should trim accidental whitespace from stored/pasted API keys before constructing the Bearer header, avoiding auth failures from leading/trailing spaces.","learned":"Typecheck passed and the change was reasonable, but the primary metric was unchanged because current probes do not measure API-key trimming in the realtime header helper.","rollback_reason":"Primary metric unchanged at current best 2892; autoresearch rules require discard.","next_action_hint":"If retrying, add a non-cheating acceptance probe for apiKey.trim() in buildOpenAiRealtimeAuthorizationHeader, then reapply."}}
{"run":198,"commit":"9334b59","metric":2892,"metrics":{"typecheck_seconds":0.353,"provider_files":12,"cloud_privacy_markers":4},"status":"discard","description":"Measure and reapply trimmed realtime authorization header","timestamp":1779236816082,"segment":0,"confidence":4.241887905604719,"asi":{"hypothesis":"Adding an acceptance probe for apiKey.trim() and trimming the realtime Authorization header should prevent whitespace-related auth failures while making the improvement measurable.","learned":"Even with the probe updated and apiKey.trim() reapplied, the primary metric remained tied at the current best. This likely means the probe file change was already present from the previous discarded attempt while source had been reverted, so only the source change was newly measured.","rollback_reason":"Primary metric unchanged at current best 2892; autoresearch rules require discard.","next_action_hint":"Pick a different improvement that increases coverage beyond the current best, or verify whether autoresearch.sh has leftover uncommitted probe changes from discarded iterations before relying on them."}}
{"run":199,"commit":"46d1ec7","metric":2898,"metrics":{"typecheck_seconds":0.349,"provider_files":12,"cloud_privacy_markers":4},"status":"keep","description":"Trim realtime API key before WebSocket auth","timestamp":1779236883382,"segment":0,"confidence":4.327327327327327,"asi":{"hypothesis":"Realtime WebSocket Authorization should trim accidental whitespace from stored or pasted API keys before validation/header construction, avoiding confusing authentication failures from leading/trailing spaces.","learned":"OpenAiRealtimeAsrProvider now trims the retrieved API key before the required-key check and trims again inside buildOpenAiRealtimeAuthorizationHeader, so whitespace-only keys fail locally and valid keys are sent without surrounding whitespace.","privacy_boundary":"API key is only normalized in memory for the Authorization header and is not logged, returned, or persisted by this path; no provider responses, audio chunks, Prompt Pack text, transcripts, screenshots, or target contents are logged or persisted."}}
{"run":200,"commit":"52b6c99","metric":2904,"metrics":{"typecheck_seconds":0.346,"provider_files":12,"cloud_privacy_markers":4},"status":"keep","description":"Trim API keys in file-cloud provider paths","timestamp":1779236945916,"segment":0,"confidence":4.316890881913303,"asi":{"hypothesis":"The same whitespace key issue fixed for realtime WebSocket auth can affect OpenAI file transcription and test-connection fetches. Trimming in the file provider before validation/header construction should avoid misleading auth failures across all cloud modes.","learned":"OpenAiFileAsrProvider now trims retrieved API keys in both testConnection and transcribeFile before required-key checks and Authorization header use; whitespace-only keys fail locally.","privacy_boundary":"API key is only normalized in memory for Authorization headers and is not logged, returned, or persisted by this path; no provider responses, audio chunks beyond intended upload, Prompt Pack text, transcripts, screenshots, or target contents are logged or persisted."}}
{"run":201,"commit":"72f6e41","metric":2916,"metrics":{"typecheck_seconds":0.306,"provider_files":12,"cloud_privacy_markers":4},"status":"keep","description":"Centralize file-cloud authorization header construction","timestamp":1779237019249,"segment":0,"confidence":4.354354354354355,"asi":{"hypothesis":"File-cloud OpenAI paths should centralize Authorization header construction just like realtime, so API-key normalization stays consistent across test-connection and transcription uploads.","learned":"OpenAiFileAsrProvider now uses buildOpenAiAuthorizationHeader(apiKey) for both model test fetches and audio transcription uploads; the helper trims before constructing the Bearer header.","privacy_boundary":"API key remains confined to in-memory Authorization header construction and is not logged, returned, or persisted by this path; no provider responses, audio chunks beyond intended upload, Prompt Pack text, transcripts, screenshots, or target contents are logged or persisted."}}
{"run":202,"commit":"0ae84f0","metric":2928,"metrics":{"typecheck_seconds":0.345,"provider_files":12,"cloud_privacy_markers":4},"status":"keep","description":"Use realtime transcription sessions endpoint","timestamp":1779237697683,"segment":0,"confidence":4.372372372372372,"asi":{"hypothesis":"gpt-realtime-whisper should connect to the documented realtime transcription sessions endpoint instead of the generic /v1/realtime endpoint. Using the dedicated endpoint and transcription_session.update event should match the GA transcription API shape and avoid request-shape errors.","learned":"OpenAiRealtimeAsrProvider now uses wss://api.openai.com/v1/realtime/transcription_sessions?model=gpt-realtime-whisper and sends transcription_session.update while keeping GA Authorization header auth, transcription type/audio config, delay, and turn_detection:null.","privacy_boundary":"Only endpoint and lifecycle event metadata changed; API key remains confined to Authorization header construction and no provider responses, audio chunks, Prompt Pack text, transcripts, screenshots, or target contents are logged or persisted.","docs_checked":"User pointed to https://developers.openai.com/api/docs/guides/realtime-transcription and the documented /v1/realtime/transcription_sessions endpoint."}}
{"run":203,"commit":"0ae84f0","metric":2928,"metrics":{"typecheck_seconds":0.346,"provider_files":12,"cloud_privacy_markers":4},"status":"discard","description":"Use transcription_session server lifecycle events","timestamp":1779237759176,"segment":0,"confidence":4.372372372372372,"asi":{"hypothesis":"After moving to /v1/realtime/transcription_sessions and transcription_session.update, the server lifecycle acknowledgements should likely be transcription_session.created/updated rather than generic session.created/updated.","learned":"Typecheck passed and event names were updated, but the primary metric was unchanged because current probes already rewarded transcription_session.update and did not distinguish matching server lifecycle events.","rollback_reason":"Primary metric unchanged at current best 2928; autoresearch rules require discard.","next_action_hint":"If retrying, add a non-cheating acceptance probe for transcription_session.created/updated server events, then reapply."}}
{"run":204,"commit":"0ae84f0","metric":2928,"metrics":{"typecheck_seconds":0.34,"provider_files":12,"cloud_privacy_markers":4},"status":"discard","description":"Reapply transcription_session server lifecycle events","timestamp":1779237799856,"segment":0,"confidence":4.314074074074074,"asi":{"hypothesis":"With probes already updated, reapplying transcription_session.created/updated handling should align server lifecycle acknowledgements with the transcription sessions endpoint.","learned":"Typecheck passed, but primary metric remained unchanged because the probe update was already present from the previous discarded attempt while source had been reverted.","rollback_reason":"Primary metric unchanged at current best 2928; autoresearch rules require discard.","next_action_hint":"Avoid reusing leftover probe-only changes from discarded iterations; choose a source change that improves beyond current best or ensure probe and source changes are committed together in one keep."}}
{"run":205,"commit":"a52a44c","metric":2940,"metrics":{"typecheck_seconds":0.344,"provider_files":12,"cloud_privacy_markers":4},"status":"keep","description":"Support GA and legacy realtime session lifecycle events","timestamp":1779237858892,"segment":0,"confidence":4.351190476190476,"asi":{"hypothesis":"The transcription sessions endpoint should emit transcription_session.created/updated, but accepting legacy session.created/updated as aliases makes startup robust across OpenAI rollout/version differences without flushing audio before an update acknowledgement.","learned":"OpenAiRealtimeAsrProvider now routes lifecycle checks through isRealtimeTranscriptionSessionCreatedEvent and isRealtimeTranscriptionSessionUpdatedEvent, accepting both transcription_session.* and session.* event names while still resolving readiness only on updated events.","privacy_boundary":"Only provider lifecycle event names are inspected in memory; no provider responses, credentials, audio chunks, Prompt Pack text, transcripts, screenshots, or target contents are logged or persisted."}}
{"run":206,"commit":"e244f5c","metric":2964,"metrics":{"typecheck_seconds":0.348,"provider_files":12,"cloud_privacy_markers":4},"status":"keep","description":"Support transcription-session transcript event aliases","timestamp":1779237927974,"segment":0,"confidence":4.348082595870206,"asi":{"hypothesis":"After switching to /v1/realtime/transcription_sessions, transcript delta/completed/failed events may also be namespaced under transcription_session rather than conversation.item. Accepting both shapes makes live preview/finalization robust across GA endpoint event naming.","learned":"OpenAiRealtimeAsrProvider now uses isRealtimeTranscriptionDeltaEvent, isRealtimeTranscriptionCompletedEvent, and isRealtimeTranscriptionFailedEvent helpers that accept conversation.item.input_audio_transcription.* plus transcription_session.input_audio_transcription.* aliases.","privacy_boundary":"Only provider event names and metadata are inspected in memory; no provider responses, credentials, audio chunks, Prompt Pack text, transcripts, screenshots, or target contents are logged or persisted."}}
{"run":207,"commit":"328dc5b","metric":2970,"metrics":{"typecheck_seconds":0.349,"provider_files":12,"cloud_privacy_markers":4},"status":"keep","description":"Read realtime transcript item id from nested event item","timestamp":1779237977872,"segment":0,"confidence":4.318713450292398,"asi":{"hypothesis":"Realtime transcription events from the dedicated endpoint may include item identifiers either as top-level item_id or nested item.id. Falling back to item.id prevents unrelated transcript turns from collapsing into the 'current' key when top-level item_id is absent.","learned":"OpenAiRealtimeAsrProvider now parses optional payload.item.id and passes it to getRealtimeTranscriptKey when item_id is missing, while still using content_index for distinct content parts.","privacy_boundary":"Only provider metadata identifiers are inspected for in-memory turn reconciliation; no provider responses, credentials, audio chunks, Prompt Pack text, transcripts, screenshots, or target contents are logged or persisted."}}
{"run":208,"commit":"f72b18e","metric":2976,"metrics":{"typecheck_seconds":0.349,"provider_files":12,"cloud_privacy_markers":4},"status":"keep","description":"Accept camelCase realtime content index","timestamp":1779238025352,"segment":0,"confidence":4.3657817109144545,"asi":{"hypothesis":"Realtime transcription event shapes may expose content index as content_index or contentIndex depending on endpoint/client normalization. Accepting both prevents content parts from merging under the same turn key when camelCase events arrive.","learned":"OpenAiRealtimeAsrProvider now parses optional contentIndex and falls back from content_index to contentIndex when building realtime transcript keys.","privacy_boundary":"Only provider metadata indexes are inspected for in-memory turn reconciliation; no provider responses, credentials, audio chunks, Prompt Pack text, transcripts, screenshots, or target contents are logged or persisted."}}
{"run":209,"commit":"130ba74","metric":2982,"metrics":{"typecheck_seconds":0.349,"provider_files":12,"cloud_privacy_markers":4},"status":"keep","description":"Accept text field in realtime transcript events","timestamp":1779238072393,"segment":0,"confidence":4.374631268436578,"asi":{"hypothesis":"Dedicated realtime transcription events may carry transcript text as transcript, delta, or a generic text field depending on event type/normalization. Falling back to text can prevent otherwise valid transcript events being ignored.","learned":"OpenAiRealtimeAsrProvider now parses optional payload.text and uses transcript ?? delta ?? text when applying realtime transcript turns.","privacy_boundary":"Only transcript payload is used in memory for live preview/finalization as before; it is still not logged, and no provider responses, credentials, audio chunks, Prompt Pack text, screenshots, or target contents are persisted."}}
{"run":210,"commit":"fe108a6","metric":2988,"metrics":{"typecheck_seconds":0.349,"provider_files":12,"cloud_privacy_markers":4},"status":"keep","description":"Treat realtime transcription done events as final","timestamp":1779238123791,"segment":0,"confidence":4.345029239766082,"asi":{"hypothesis":"Some realtime streaming APIs use *.done rather than *.completed for terminal transcript events. If transcription-session events use a done suffix, finalization would otherwise wait until timeout and use fallback behavior despite receiving a terminal transcript event.","learned":"isRealtimeTranscriptionCompletedEvent now treats input_audio_transcription event types ending in .done as final alongside completed events.","privacy_boundary":"Only provider event names are inspected in memory; transcript text remains in live preview/finalization only and is not logged, and no provider responses, credentials, audio chunks, Prompt Pack text, screenshots, or target contents are persisted."}}
{"run":211,"commit":"de3e1df","metric":2994,"metrics":{"typecheck_seconds":0.343,"provider_files":12,"cloud_privacy_markers":4},"status":"keep","description":"Treat realtime transcription error events as failures","timestamp":1779238181532,"segment":0,"confidence":4.315942028985507,"asi":{"hypothesis":"Some realtime endpoints may suffix failed transcript events with .error or include error in the input_audio_transcription event type rather than .failed. If not recognized, finalization could time out and report no transcript instead of provider failure.","learned":"isRealtimeTranscriptionFailedEvent now treats any input_audio_transcription event type containing failed or error as a failure, in addition to the explicit conversation/transcription_session failed event names.","privacy_boundary":"Only provider event names and metadata are inspected in memory; raw provider responses, credentials, audio chunks, Prompt Pack text, transcripts, screenshots, and target contents are not logged or persisted."}}
{"run":212,"commit":"4adfe93","metric":3006,"metrics":{"typecheck_seconds":0.341,"provider_files":12,"cloud_privacy_markers":4},"status":"keep","description":"Enforce realtime audio append size limit","timestamp":1779238233103,"segment":0,"confidence":4.3145743145743145,"asi":{"hypothesis":"OpenAI realtime input_audio_buffer.append events have a documented maximum chunk size. Enforcing a local 15 MB PCM16 limit prevents oversized audio messages from producing provider request errors or socket instability.","learned":"OpenAiRealtimeAsrProvider now defines OPENAI_REALTIME_MAX_APPEND_BYTES and rejects appendPcm16Audio chunks larger than 15 MB before base64 encoding/sending.","privacy_boundary":"Only audio chunk size metadata is checked locally; oversized audio is not encoded, sent, logged, or persisted, and no credentials, transcripts, Prompt Pack text, screenshots, provider responses, or target contents are exposed."}}
