{"run":77,"commit":"61ea0fd","metric":1446,"metrics":{"typecheck_seconds":0.343,"provider_files":8,"cloud_privacy_markers":4},"status":"keep","description":"Expose Prompt Pack caps in preview metadata","timestamp":1779228284787,"segment":0,"confidence":3.7239583333333335,"asi":{"hypothesis":"Prompt Pack preview should make the 50-term and 1000-character limits visible to users/debuggers so the compact cloud context boundary is understandable.","learned":"PromptPack now carries termLimit=50 and characterLimit=1000, buildCloudPromptPack populates those fields from the constants, and preview text shows used/limit counts plus truncation status.","privacy_boundary":"Preview still only displays user-requested capped Prompt Pack text after consent/cloud-mode gating; no screenshots/full dictionary/transcript history are included."}}
{"run":78,"commit":"c17c3fe","metric":1458,"metrics":{"typecheck_seconds":0.336,"provider_files":9,"cloud_privacy_markers":4},"status":"keep","description":"Share Prompt Pack limit constants across UI and builder","timestamp":1779228385883,"segment":0,"confidence":3.6974358974358976,"asi":{"hypothesis":"Prompt Pack caps should live in a shared module so UI copy, PromptPack metadata, and builder enforcement cannot drift from the 50-term/1000-character privacy boundary.","learned":"Added shared prompt-pack-limits.ts with PROMPT_PACK_MAX_TERMS and PROMPT_PACK_MAX_CHARS, typed PromptPack limits from it, imported limits in builder, and updated Settings copy to render the shared constants.","privacy_boundary":"Keeps the compact cloud context cap consistent across enforcement and user-facing preview/copy."}}
{"run":79,"commit":"b785938","metric":1470,"metrics":{"typecheck_seconds":0.336,"provider_files":9,"cloud_privacy_markers":4},"status":"keep","description":"Normalize cloud rawText history metadata","timestamp":1779228507077,"segment":0,"confidence":3.6717171717171717,"asi":{"hypothesis":"Cloud history rawText should represent normalized provider-final text before local corrections, not raw provider formatting noise, matching the PRD history contract.","learned":"OpenAI file transcription now compares/stores normalizedText for rawText instead of raw providerText, and realtime history normalizes composed/corrected provider text before deciding whether rawText differs.","privacy_boundary":"This changes local history metadata only; no provider response bodies are logged or sent elsewhere."}}
{"run":80,"commit":"b785938","metric":1470,"metrics":{"typecheck_seconds":0.34,"provider_files":9,"cloud_privacy_markers":4},"status":"discard","description":"Make cloud preview gate depend on build type not Developer Mode UI","timestamp":1779228551770,"segment":0,"confidence":3.616915422885572,"asi":{"hypothesis":"Developer Mode is only an alternate UI surface, so developer cloud mode preview should depend on running a developer build, not on the developerModeEnabled setting.","learned":"Typecheck passed and the user correction is valid, but primary metric was unchanged after updating the probe because the previous broader probe still matched.","rollback_reason":"Primary metric unchanged; autoresearch rules require discard.","next_action_hint":"Reapply with a distinct negative probe that ensures developerCloudModePreviewEnabled no longer references developerModeEnabled, or bundle with related mode availability cleanup."}}
{"run":81,"commit":"956d548","metric":1476,"metrics":{"typecheck_seconds":0.339,"provider_files":9,"cloud_privacy_markers":4},"status":"keep","description":"Gate developer cloud preview by build type only","timestamp":1779228613996,"segment":0,"confidence":3.6318407960199006,"asi":{"hypothesis":"Developer Mode is just an alternate UI surface, so staged cloud mode selection should depend on running a developer build, not on the developerModeEnabled setting.","learned":"developerCloudModePreviewEnabled now equals isDeveloperBuild only. Added a negative acceptance probe to prevent reintroducing a dependency on developerModeEnabled for this release/developer cloud availability gate.","user_feedback":"Implements user's correction that state.settings?.developerModeEnabled should not control developerCloudModePreviewEnabled.","privacy_boundary":"Only selection availability in developer builds changes; consent/API-key/offline/profile gates still protect actual cloud use."}}
{"run":82,"commit":"36ba729","metric":1494,"metrics":{"typecheck_seconds":0.345,"provider_files":9,"cloud_privacy_markers":4},"status":"keep","description":"Separate release readiness flags from developer cloud preview override","timestamp":1779228676166,"segment":0,"confidence":3.6766169154228856,"asi":{"hypothesis":"Cloud mode availability should distinguish actual release readiness from the developer-build override so future realtime/file readiness can be wired without conflating it with dev preview access.","learned":"Renderer now defines openAiModesReadyForRelease=false and realtimeStreamingReady=false separately, then derives cloudModeSelectionReady/realtimeModeSelectionReady by OR-ing those release flags with developerCloudModePreviewEnabled. Availability receives the derived flags.","user_feedback":"Keeps Developer Mode UI setting out of cloud preview logic while making build-vs-readiness semantics clearer.","privacy_boundary":"Selection gating only; cloud consent/API-key/offline/profile enforcement remains unchanged."}}
{"run":83,"commit":"b29a081","metric":1512,"metrics":{"typecheck_seconds":0.339,"provider_files":9,"cloud_privacy_markers":4},"status":"keep","description":"Show cloud release gate status in settings","timestamp":1779228742449,"segment":0,"confidence":3.6666666666666665,"asi":{"hypothesis":"Since cloud selection now depends on release readiness plus developer-build preview, Settings should make that gate state visible so users/testers understand why modes are available or disabled.","learned":"Settings header now shows a cloud gate chip: Developer build cloud preview, Cloud Dictation ready, or Cloud Dictation release-gated, based on the separated readiness/preview flags.","privacy_boundary":"Only capability/status metadata is displayed; no cloud payloads, credentials, Prompt Pack, transcript, audio, or target content is exposed."}}
{"run":84,"commit":"a2123b5","metric":1530,"metrics":{"typecheck_seconds":0.339,"provider_files":10,"cloud_privacy_markers":4},"status":"keep","description":"Track OpenAI mode implementation readiness explicitly","timestamp":1779228839310,"segment":0,"confidence":3.7107843137254903,"asi":{"hypothesis":"Release gating should be driven by explicit per-mode implementation readiness rather than opaque hard-coded booleans in the renderer.","learned":"Added shared openai-readiness.ts with fileAccuracyReady=true, fileEconomyReady=true, realtimeReady=false, plus areAllOpenAiModesReadyForRelease. Renderer now derives release gating and realtime readiness from that shared readiness object.","prd_alignment":"Makes it clear that non-realtime OpenAI modes are implemented, but release Cloud Dictation remains gated because realtime gpt-realtime-whisper is not fully wired.","privacy_boundary":"Only capability metadata changed; no cloud payload or credential handling changed."}}
{"run":85,"commit":"19971f5","metric":1548,"metrics":{"typecheck_seconds":0.341,"provider_files":10,"cloud_privacy_markers":4},"status":"keep","description":"Use per-mode OpenAI readiness in mode availability","timestamp":1779228925142,"segment":0,"confidence":3.7549019607843137,"asi":{"hypothesis":"Mode availability should distinguish a specific OpenAI mode being unimplemented from the broader release gate that waits for all OpenAI modes.","learned":"Added isOpenAiModeImplemented and passed openAiReadiness into getDictationModeAvailability. Availability now first checks whether the individual OpenAI mode is implemented, then applies the broader all-modes release gate.","prd_alignment":"Allows accurate reasons: realtime can say it is not implemented yet while accuracy/economy can be implemented but still release-gated until all modes are ready.","privacy_boundary":"Selection reason metadata only; no change to cloud payloads or provider calls."}}
{"run":86,"commit":"fae4be4","metric":1566,"metrics":{"typecheck_seconds":0.337,"provider_files":10,"cloud_privacy_markers":4},"status":"keep","description":"Add structured reason codes for dictation mode availability","timestamp":1779229003094,"segment":0,"confidence":3.7170263788968825,"asi":{"hypothesis":"Mode availability should expose structured reason codes in addition to display text, so UI/tests/future logic do not depend on parsing human-readable strings.","learned":"DictationModeAvailability now includes reasonCode values for offline, mode_not_implemented, release_gated, realtime_not_ready, and api_key_required. Existing reason strings remain for UI display.","privacy_boundary":"Only local availability metadata changed; no provider calls, cloud payloads, or sensitive data handling changed."}}
{"run":87,"commit":"a9250b8","metric":1590,"metrics":{"typecheck_seconds":0.339,"provider_files":11,"cloud_privacy_markers":4},"status":"keep","description":"Expose OpenAI credential source and encryption status","timestamp":1779229293326,"segment":0,"confidence":3.7476190476190476,"asi":{"hypothesis":"Cloud Dictation setup should distinguish environment-provided API keys from stored BYOK credentials and expose OS encryption availability so users understand what VoxType stores.","learned":"Added shared OpenAiCredentialStatus, OpenAiCredentialStore.getStatus, IPC/preload typing, and Settings copy that reports OPENAI_API_KEY environment use without implying VoxType stored it. Status also carries safeStorage encryption availability.","privacy_boundary":"No API key value is exposed; only metadata source/encryption availability is returned to the renderer."}}
{"run":88,"commit":"ac7b63b","metric":1602,"metrics":{"typecheck_seconds":0.337,"provider_files":11,"cloud_privacy_markers":4},"status":"keep","description":"Prevent clearing environment-provided OpenAI keys","timestamp":1779229319899,"segment":0,"confidence":3.7494089834515365,"asi":{"hypothesis":"When Cloud Dictation uses OPENAI_API_KEY from the environment, the Settings UI should not offer a misleading clear action because VoxType has no stored key to remove.","learned":"The OpenAI credential clear button is now labeled for stored keys and disabled when credential status reports source=environment, while stored BYOK credentials remain clearable.","privacy_boundary":"Only credential metadata controls UI affordances; API key values remain inaccessible to the renderer."}}
{"run":89,"commit":"8cd5cad","metric":1620,"metrics":{"typecheck_seconds":0.341,"provider_files":11,"cloud_privacy_markers":4},"status":"keep","description":"Centralize Cloud Dictation consent copy","timestamp":1779229366636,"segment":0,"confidence":3.712962962962963,"asi":{"hypothesis":"Consent wording is part of the privacy boundary and should be centralized so setup UI consistently states what is and is not sent to OpenAI.","learned":"Added shared cloud consent copy for the microphone/Prompt Pack disclosure, explicit exclusions including insertion target contents, and Offline Mode/profile blocking notice; Settings renders that shared copy.","privacy_boundary":"Improves disclosure only; no new cloud payload, credential, audio, transcript, OCR, or Prompt Pack flow is introduced."}}
{"run":90,"commit":"112d78e","metric":1644,"metrics":{"typecheck_seconds":0.333,"provider_files":11,"cloud_privacy_markers":4},"status":"keep","description":"Record Cloud Dictation consent timestamp","timestamp":1779229413498,"segment":0,"confidence":3.7685185185185186,"asi":{"hypothesis":"One-time Cloud Dictation consent should retain when the user accepted it so setup state is auditable without storing sensitive data.","learned":"Settings now include cloudDictationConsentAcceptedAt, default it to null, stamp it only on false-to-true consent transitions, clear it when consent is revoked, sanitize persisted values, and show the accepted date in Settings.","privacy_boundary":"The timestamp is consent metadata only; it contains no audio, transcripts, Prompt Pack text, screenshots, target content, or API key material."}}
{"run":91,"commit":"698f64a","metric":1656,"metrics":{"typecheck_seconds":0.337,"provider_files":11,"cloud_privacy_markers":4},"status":"keep","description":"Block OpenAI test connection without API key","timestamp":1779229446004,"segment":0,"confidence":3.7962962962962963,"asi":{"hypothesis":"The OpenAI test-connection IPC should enforce the same setup boundary as recording and avoid any network attempt when no API key is configured.","learned":"openai:test-connection now checks hasApiKey after the Offline Mode kill switch and returns a clear local setup error before resolving a model or calling the provider.","privacy_boundary":"This reduces accidental network behavior; no key, audio, Prompt Pack, transcript, screenshot, or target content is sent."}}
{"run":92,"commit":"f089ab4","metric":1668,"metrics":{"typecheck_seconds":0.336,"provider_files":11,"cloud_privacy_markers":4},"status":"keep","description":"Explain disabled OpenAI test connection states","timestamp":1779229472122,"segment":0,"confidence":3.771689497716895,"asi":{"hypothesis":"When the OpenAI test connection button is disabled, Settings should explain whether Offline Mode or missing API key setup is responsible.","learned":"The test-connection button now has state-specific title text for Offline Mode, missing API key, and the ready-to-test state, matching IPC setup gates.","privacy_boundary":"UI metadata only; no additional network calls or sensitive data exposure."}}
{"run":93,"commit":"102102d","metric":1692,"metrics":{"typecheck_seconds":0.342,"provider_files":11,"cloud_privacy_markers":4},"status":"keep","description":"Add structured Cloud Dictation readiness reason codes","timestamp":1779229512038,"segment":0,"confidence":3.8796296296296298,"asi":{"hypothesis":"Cloud Dictation readiness should expose stable machine-readable reason codes so UI and orchestration can branch on setup/offline/API-key states without parsing user-facing strings.","learned":"CloudDictationReadiness now includes reasonCode for local_ready, offline_mode, consent_required, api_key_required, and cloud_ready while preserving existing reason text.","privacy_boundary":"Only local readiness metadata changed; no provider calls or sensitive payload handling changed."}}
{"run":94,"commit":"715ea2a","metric":1710,"metrics":{"typecheck_seconds":0.341,"provider_files":11,"cloud_privacy_markers":4},"status":"keep","description":"Clarify Cloud setup readiness details","timestamp":1779229547705,"segment":0,"confidence":3.976525821596244,"asi":{"hypothesis":"The release setup checklist should tell users exactly which Cloud Dictation setup gate remains: consent, API key, environment key, or stored key.","learned":"Added cloudSetupDetail in the renderer to distinguish local dictation, missing consent, missing API key, OPENAI_API_KEY environment setup, and stored key readiness instead of one generic setup message.","privacy_boundary":"Only setup metadata/copy changed; the renderer still receives no API key value and no cloud payloads are affected."}}
{"run":95,"commit":"503ebb9","metric":1722,"metrics":{"typecheck_seconds":0.337,"provider_files":11,"cloud_privacy_markers":4},"status":"keep","description":"Terminate effective cloud profile sessions on Offline Mode","timestamp":1779229592558,"segment":0,"confidence":4.061904761904762,"asi":{"hypothesis":"Offline Mode should terminate any active Cloud Dictation session based on the effective mode, including App Profile overrides, not just the global settings mode.","learned":"Renderer offline-mode handling now checks activeModeIsCloud when deciding whether to stop recording, so cloud sessions selected by profile override are covered by the kill switch.","privacy_boundary":"This strengthens the Offline Mode cloud kill switch and does not add any cloud payloads or sensitive data handling."}}
{"run":96,"commit":"c14669d","metric":1740,"metrics":{"typecheck_seconds":0.336,"provider_files":11,"cloud_privacy_markers":4},"status":"keep","description":"Expose profile cloud-forbid fallback in readiness","timestamp":1779229640357,"segment":0,"confidence":4.046948356807512,"asi":{"hypothesis":"Cloud readiness should preserve the originally requested effective mode and indicate when an App Profile forbids cloud, so fallback to local dictation is explicit rather than silent.","learned":"CloudDictationReadiness now includes requestedModeId and profileForbidsCloud. When a profile-forbidden cloud mode falls back to Local balanced, readiness returns a clear reason while staying ready for local dictation.","privacy_boundary":"This only exposes local routing metadata and strengthens profile cloud-block transparency; no cloud payloads, credentials, audio, Prompt Pack text, screenshots, or transcript data are added."}}
{"run":97,"commit":"211842d","metric":1752,"metrics":{"typecheck_seconds":0.339,"provider_files":11,"cloud_privacy_markers":4},"status":"keep","description":"Notify when profile forces local dictation","timestamp":1779229677354,"segment":0,"confidence":4.075117370892019,"asi":{"hypothesis":"When an App Profile forbids Cloud Dictation and readiness falls back to local dictation, the user should see that routing decision instead of silently recording locally.","learned":"startRecording now displays the readiness reason as a busy message when profileForbidsCloud is true, making profile-enforced local fallback visible while still allowing local dictation to proceed.","privacy_boundary":"Only local routing/status UI changed; no cloud call, credential, audio, Prompt Pack, OCR, screenshot, transcript, or target content handling changed."}}
{"run":98,"commit":"5df400a","metric":1770,"metrics":{"typecheck_seconds":0.337,"provider_files":11,"cloud_privacy_markers":4},"status":"keep","description":"Validate local fallback model from readiness mode","timestamp":1779229721834,"segment":0,"confidence":4.060185185185185,"asi":{"hypothesis":"When readiness resolves a cloud request to a local fallback mode, recording should validate the fallback mode's required local model rather than whatever model is currently active in settings.","learned":"startRecording now derives readinessMode from readiness.modeId, finds readinessLocalModel by that mode's modelId, and reports the exact fallback model label/model ID that must be downloaded before recording.","privacy_boundary":"This only affects local preflight validation and error copy; no cloud calls, credentials, audio, Prompt Pack, OCR, screenshots, transcripts, or target content are added."}}
{"run":99,"commit":"0413357","metric":1788,"metrics":{"typecheck_seconds":0.34,"provider_files":11,"cloud_privacy_markers":4},"status":"keep","description":"Reuse cloud readiness gates in transcription service","timestamp":1779229768025,"segment":0,"confidence":4.15962441314554,"asi":{"hypothesis":"Cloud file transcription should use the same readiness policy as renderer preflight so consent, Offline Mode, API-key, and profile-forbid behavior cannot drift.","learned":"Added getCloudDictationReadinessForMode and changed transcribeCloudFile to call it with the requested cloud mode and current API-key status. Removed the duplicate private block-reason method from TranscriptionService.","privacy_boundary":"This consolidates local gate checks before any provider call; no new cloud payloads or sensitive data are exposed."}}
{"run":100,"commit":"2c8a040","metric":1818,"metrics":{"typecheck_seconds":0.356,"provider_files":11,"cloud_privacy_markers":4},"status":"keep","description":"Add main-process realtime cloud session IPC","timestamp":1779229848756,"segment":0,"confidence":4.29047619047619,"asi":{"hypothesis":"Realtime Cloud Dictation needs a main-process session API before the renderer can stream native PCM audio through Electron to OpenAI and save final turn history.","learned":"Added active RealtimeCloudSession state, realtime start/append/finalize/cancel IPC handlers, prompt-pack construction at start, readiness gating for openai.realtime, and finalization through RealtimeCloudHistoryService. Preload exposes typed startRealtime, appendRealtimePcm16, finalizeRealtime, and cancelRealtime methods.","privacy_boundary":"Realtime start still uses existing readiness/consent/API-key/profile gates, sends only audio plus capped Prompt Pack, and final history stores turn metadata without saved realtime audio."}}
{"run":101,"commit":"ffe7c28","metric":1830,"metrics":{"typecheck_seconds":0.342,"provider_files":11,"cloud_privacy_markers":4},"status":"keep","description":"Cancel realtime cloud session on Offline Mode stop","timestamp":1779229892475,"segment":0,"confidence":4.381642512077295,"asi":{"hypothesis":"The Offline Mode kill switch should cancel any main-process realtime OpenAI session as well as stopping the renderer/native recorder, so the socket cannot remain open after the user goes offline.","learned":"terminateActiveCloudDictationForOfflineMode now calls transcription.cancelRealtime with the Offline Mode reason after stopping the native recorder and before coordination cleanup. The existing realtime-cancel IPC clears active session state in main.","privacy_boundary":"This closes a cloud connection on the kill switch and does not send additional audio, Prompt Pack text, transcripts, screenshots, credentials, or target content."}}
