{"run":53,"commit":"a20a4dd","metric":1110,"metrics":{"typecheck_seconds":0.338,"provider_files":6,"cloud_privacy_markers":4},"status":"keep","description":"Require cloud consent before building Prompt Pack","timestamp":1779225555842,"segment":0,"confidence":4.24031007751938,"asi":{"hypothesis":"Prompt Pack construction itself should enforce Cloud Dictation consent so future preview/realtime code cannot accidentally prepare cloud-bound context before consent.","learned":"buildCloudPromptPack now requires consentAccepted and throws before reading dictionary/OCR context when consent is false. Existing cloud transcription and preview callers pass settings.cloudDictationConsentAccepted after readiness checks.","privacy_boundary":"This moves the consent boundary closer to context preparation, reducing risk that dictionary/OCR terms are prepared for cloud paths without explicit consent."}}
{"run":54,"commit":"de92cf4","metric":1122,"metrics":{"typecheck_seconds":0.34,"provider_files":6,"cloud_privacy_markers":4},"status":"keep","description":"Clamp cloud max duration to warning threshold","timestamp":1779225626728,"segment":0,"confidence":4.388888888888889,"asi":{"hypothesis":"Cloud session max duration should not sanitize below the warning threshold; otherwise users could configure a warning that never appears before auto-finalize.","learned":"Settings sanitization now routes cloudSessionMaxMs through sanitizeCloudSessionMaxMs, preserving null/unlimited, defaulting invalid values, and clamping numeric max to at least the sanitized warning duration. Settings UI reflects the normalized max minutes.","privacy_boundary":"Only duration control metadata changed; no cost estimate or sensitive content exposure."}}
{"run":55,"commit":"706c543","metric":1152,"metrics":{"typecheck_seconds":0.34,"provider_files":7,"cloud_privacy_markers":4},"status":"keep","description":"Classify OpenAI errors into friendly setup categories","timestamp":1779225702637,"segment":0,"confidence":4.403100775193798,"asi":{"hypothesis":"BYOK users need actionable OpenAI error messages for invalid key, billing/quota, rate limit, and model access problems without exposing provider response bodies.","learned":"Added shared OpenAI error classifier/formatter and wired OpenAiFileAsrProvider to use it. Errors now have friendly summaries plus metadata-only technical details based on status/type/code, while provider response bodies remain excluded.","privacy_boundary":"Only status, statusText, error type, and error code are surfaced as technical details; raw provider message/body is used only for classification and not included verbatim."}}
{"run":56,"commit":"248fcec","metric":1170,"metrics":{"typecheck_seconds":0.342,"provider_files":7,"cloud_privacy_markers":4},"status":"keep","description":"Add explicit no automatic local fallback policy for cloud failures","timestamp":1779225761206,"segment":0,"confidence":4.322097378277154,"asi":{"hypothesis":"Cloud failure handling should encode the privacy policy that VoxType does not automatically retry failed cloud dictation locally, except separate profile-forbid local routing before cloud starts.","learned":"Added shared getCloudFailurePolicy returning allowAutomaticLocalFallback=false for cloud modes with a user-facing explanation that automatic local retry could change privacy and accuracy expectations.","privacy_boundary":"Prevents future error-recovery code from silently changing provider boundary after a cloud failure."}}
{"run":57,"commit":"425a2d7","metric":1182,"metrics":{"typecheck_seconds":0.338,"provider_files":7,"cloud_privacy_markers":4},"status":"keep","description":"Make release settings panel scrollable","timestamp":1779225836169,"segment":0,"confidence":4.22463768115942,"asi":{"hypothesis":"As Cloud Dictation adds more setup controls, the release Settings page needs the same internal scrolling behavior as Models/Profiles/History to keep all settings reachable in the fixed-size window.","learned":"Settings panel now uses the existing release-scroll-panel pattern and .settings-list participates in the scrollable content selector, matching the models page behavior requested by the user.","ux_alignment":"Prevents newly added cloud controls from pushing lower settings out of reach without changing settings semantics."}}
{"run":58,"commit":"20cfc73","metric":1200,"metrics":{"typecheck_seconds":0.342,"provider_files":7,"cloud_privacy_markers":4},"status":"keep","description":"Apply cloud no-fallback policy to transcription failures","timestamp":1779225892712,"segment":0,"confidence":4.336996336996337,"asi":{"hypothesis":"The explicit no-automatic-local-fallback policy should be surfaced on actual cloud transcription failures, not just exist as a shared policy helper.","learned":"Cloud file transcription failure handling now fetches getCloudFailurePolicy(mode.id) after metadata-only failure logging and prepends the user-facing no-local-retry explanation before rethrowing the OpenAI error details.","privacy_boundary":"Failure path still logs only metadata and does not retry locally or expose audio, Prompt Pack, transcript text, provider response bodies, or API keys."}}
{"run":59,"commit":"e858cc9","metric":1230,"metrics":{"typecheck_seconds":0.334,"provider_files":7,"cloud_privacy_markers":4},"status":"keep","description":"Validate cloud history metadata when loading transcript history","timestamp":1779225960599,"segment":0,"confidence":4.304964539007092,"asi":{"hypothesis":"Now that history entries include provider, mode, turn, and realtime no-audio metadata, history loading should validate those fields so corrupted or stale entries do not break cloud-aware UI.","learned":"HistoryStore validation now accepts only providerId local-whisper/openai, validates dictationModeId with isDictationModeId, and checks turnCount/turnStatus types while preserving backwards compatibility for entries without those optional fields.","privacy_boundary":"Validation only covers local history metadata and does not add sensitive storage."}}
{"run":60,"commit":"e858cc9","metric":1230,"metrics":{"typecheck_seconds":0.337,"provider_files":7,"cloud_privacy_markers":4},"status":"discard","description":"Show provider label in recent history cards","timestamp":1779226023296,"segment":0,"confidence":4.2596491228070175,"asi":{"hypothesis":"Recent history on the home screen should show whether a transcript came from Cloud Dictation or local dictation, making cloud provenance visible outside the detailed History tab.","learned":"Typecheck passed and UI change was real, but the existing primary metric already counted provider-label rendering elsewhere and did not improve.","rollback_reason":"Primary metric unchanged, so autoresearch rules require discard.","next_action_hint":"If pursuing this UX improvement, first add a distinct acceptance probe for recent-history provider provenance or bundle with a larger measurable history provenance improvement."}}
{"run":61,"commit":"42d2cf1","metric":1236,"metrics":{"typecheck_seconds":0.343,"provider_files":7,"cloud_privacy_markers":4},"status":"keep","description":"Show provider provenance in recent history cards","timestamp":1779226117999,"segment":0,"confidence":4.236111111111111,"asi":{"hypothesis":"The home screen recent-history cards should show Cloud Dictation vs Local dictation provenance, not just the full History tab, so cloud-originated text remains visibly distinct.","learned":"Recent history rows now include a small provider label derived from entry.providerId. Added a distinct acceptance probe for recent-history provenance after the prior attempt was invisible to the metric.","privacy_boundary":"Only provider provenance metadata is displayed; no Prompt Pack, transcript history internals, audio, target content, or credentials are exposed."}}
{"run":62,"commit":"5f17d63","metric":1254,"metrics":{"typecheck_seconds":0.342,"provider_files":7,"cloud_privacy_markers":4},"status":"keep","description":"Add provider-specific language hint mapping","timestamp":1779226193276,"segment":0,"confidence":4.168350168350169,"asi":{"hypothesis":"Dictation Language is provider-neutral, but provider adapters should translate it into supported provider-specific hints rather than blindly passing settings values.","learned":"Added shared getProviderLanguageHint for local-whisper/openai. OpenAI file provider now asks for the OpenAI-specific hint and only sends a language parameter when a non-auto supported hint exists.","privacy_boundary":"Language hint is non-sensitive control metadata; no transcript, Prompt Pack, audio, target content, or credentials are exposed."}}
{"run":63,"commit":"00ad847","metric":1266,"metrics":{"typecheck_seconds":0.342,"provider_files":7,"cloud_privacy_markers":4},"status":"keep","description":"Apply provider language hints to realtime OpenAI sessions","timestamp":1779226276699,"segment":0,"confidence":4.2517006802721085,"asi":{"hypothesis":"Realtime OpenAI sessions should use the same provider-specific language hint mapping as file transcription so Dictation Language remains provider-neutral across modes.","learned":"OpenAiRealtimeAsrProvider now passes request.language through getProviderLanguageHint('openai', language) and includes the supported non-auto language in input_audio_transcription. Auto/unsupported hints are omitted.","privacy_boundary":"Language is non-sensitive control metadata; no audio, transcript, Prompt Pack, target content, provider response, or credential data is exposed."}}
{"run":64,"commit":"f43be55","metric":1278,"metrics":{"typecheck_seconds":0.336,"provider_files":7,"cloud_privacy_markers":4},"status":"keep","description":"Restrict OpenAI credential file permissions","timestamp":1779226339341,"segment":0,"confidence":4.1650165016501655,"asi":{"hypothesis":"Even though the OpenAI API key is encrypted with Electron safeStorage, the credential file should be written with restrictive permissions as defense in depth.","learned":"OpenAiCredentialStore now writes the encrypted key file with mode 0600 and best-effort chmods it to 0600 after writing. The API key still never goes into settings JSON and getStatus still returns only hasApiKey.","privacy_boundary":"This hardens local secret storage without changing cloud request payloads or exposing credentials."}}
{"run":65,"commit":"c1f6f78","metric":1290,"metrics":{"typecheck_seconds":0.344,"provider_files":7,"cloud_privacy_markers":4},"status":"keep","description":"Disable OpenAI test connection in Offline Mode","timestamp":1779226412844,"segment":0,"confidence":4.083333333333333,"asi":{"hypothesis":"Offline Mode is the cloud kill switch, so even setup validation should not contact OpenAI while it is enabled.","learned":"Main openai:test-connection handler now returns a clear disabled message when settings.offlineMode is true, and the Settings UI disables the Test connection button while Offline Mode is active.","privacy_boundary":"Prevents network calls to OpenAI during Offline Mode; no credentials or context are sent."}}
{"run":66,"commit":"5687ce8","metric":1308,"metrics":{"typecheck_seconds":0.344,"provider_files":7,"cloud_privacy_markers":4},"status":"keep","description":"Classify OpenAI realtime error events","timestamp":1779226482907,"segment":0,"confidence":3.9876543209876543,"asi":{"hypothesis":"Realtime OpenAI provider should use the same friendly metadata-only error classification as file transcription when provider error events arrive.","learned":"OpenAiRealtimeAsrProvider now detects provider error events, formats them through classifyOpenAiError/formatOpenAiFriendlyError, and throws a friendly error without logging raw provider responses or transcript payloads.","privacy_boundary":"Only provider error code/type/message are used for classification; raw responses are not logged or surfaced verbatim."}}
{"run":67,"commit":"9d066e8","metric":1326,"metrics":{"typecheck_seconds":0.339,"provider_files":7,"cloud_privacy_markers":4},"status":"keep","description":"Route realtime OpenAI errors through session callback","timestamp":1779226550319,"segment":0,"confidence":3.8988095238095237,"asi":{"hypothesis":"Realtime provider error events should be delivered through an explicit callback instead of thrown from an event listener, so orchestration can surface the failure state predictably.","learned":"OpenAiRealtimeAsrProvider now supports RealtimeErrorCallback and calls it with friendly classified errors. RealtimeCloudSession wires that callback to update the overlay in Finalizing state with Cloud Dictation label and the friendly error message.","privacy_boundary":"Errors remain classified/friendly and metadata-only; no raw provider responses, transcript text, Prompt Pack, audio, target content, or API key is surfaced."}}
{"run":68,"commit":"50246ea","metric":1344,"metrics":{"typecheck_seconds":0.344,"provider_files":7,"cloud_privacy_markers":4},"status":"keep","description":"Make realtime cloud session finalization idempotent","timestamp":1779226613004,"segment":0,"confidence":3.9174041297935105,"asi":{"hypothesis":"Realtime session orchestration needs safe finalize/cancel semantics so hotkey stop, error handling, offline kill switch, and duration auto-stop do not double-commit or double-close the OpenAI socket.","learned":"RealtimeCloudSession now tracks finalized state, makes finalize idempotent, adds cancel that stops without committing audio, and shares a snapshot helper for startedAt/turns.","privacy_boundary":"This is lifecycle control only; no additional payloads, logs, or cloud data are introduced."}}
{"run":69,"commit":"7b5b165","metric":1362,"metrics":{"typecheck_seconds":0.338,"provider_files":7,"cloud_privacy_markers":4},"status":"keep","description":"Clear cloud overlay metadata when hiding overlay","timestamp":1779226679056,"segment":0,"confidence":3.867816091954023,"asi":{"hypothesis":"Cloud overlay metadata such as provider label, elapsed time, and live preview turns should not persist into later local recordings after the overlay is hidden.","learned":"hideOverlay now clears cloudProviderLabel, elapsedMs, and livePreviewTurns alongside visible/level reset, preventing stale cloud status or preview text from leaking into subsequent overlay sessions.","privacy_boundary":"This reduces accidental display of stale live preview transcript text; no new cloud data flow is introduced."}}
{"run":70,"commit":"f925255","metric":1374,"metrics":{"typecheck_seconds":0.344,"provider_files":7,"cloud_privacy_markers":4},"status":"keep","description":"Centralize OpenAI transcription model IDs","timestamp":1779227729527,"segment":0,"confidence":3.8361581920903953,"asi":{"hypothesis":"OpenAI model IDs should be centralized so the realtime model remains exactly gpt-realtime-whisper across mode metadata, WebSocket URL, session validation, and transcription config.","learned":"Added shared OPENAI_REALTIME_WHISPER_MODEL_ID, OPENAI_TRANSCRIBE_MODEL_ID, and OPENAI_MINI_TRANSCRIBE_MODEL_ID constants. Dictation modes, realtime provider URL/validation/session config, and test-connection fallback now reference shared constants instead of duplicated literals.","user_feedback":"User explicitly reminded that the realtime model is called gpt-realtime-whisper; this change prevents future drift or accidental rename.","privacy_boundary":"No runtime behavior or data flow changed beyond model ID consistency."}}
{"run":71,"commit":"29b3851","metric":1386,"metrics":{"typecheck_seconds":0.336,"provider_files":8,"cloud_privacy_markers":4},"status":"keep","description":"Move OpenAI model constants into dedicated model map","timestamp":1779227844471,"segment":0,"confidence":3.8055555555555554,"asi":{"hypothesis":"OpenAI model IDs and mode-to-model mapping deserve a dedicated shared module so providers, mode metadata, and setup validation all resolve from one authoritative map.","learned":"Added shared openai-models.ts with OPENAI_REALTIME_WHISPER_MODEL_ID=gpt-realtime-whisper, file transcription model constants, openAiModeModelIds, and getOpenAiModelIdForMode. Realtime provider and test-connection handler now import from this dedicated map.","user_feedback":"Preserves the user's correction that the realtime model ID is exactly gpt-realtime-whisper while reducing future drift.","privacy_boundary":"No data flow changes; only model metadata organization."}}
{"run":72,"commit":"846ba59","metric":1398,"metrics":{"typecheck_seconds":0.343,"provider_files":8,"cloud_privacy_markers":4},"status":"keep","description":"Gate release cloud mode selection until all OpenAI modes are ready","timestamp":1779227936319,"segment":0,"confidence":3.8071625344352618,"asi":{"hypothesis":"The normal release UI should not allow selecting Cloud Dictation until all three OpenAI modes, including realtime gpt-realtime-whisper, are functional.","learned":"Dictation mode availability now accepts allOpenAiModesReadyForRelease and disables every OpenAI mode with a clear reason until that flag is true. Release Settings currently passes false because realtime streaming remains unwired.","prd_alignment":"Matches the PRD requirement that the release UI exposes Cloud Dictation only once all three OpenAI modes are functional, while keeping unavailable modes visible with a reason.","privacy_boundary":"This is a UI selection gate only; it reduces accidental cloud use and does not change payload handling."}}
{"run":73,"commit":"50cfb18","metric":1404,"metrics":{"typecheck_seconds":0.342,"provider_files":8,"cloud_privacy_markers":4},"status":"keep","description":"Allow developer-mode preview of cloud mode selection","timestamp":1779228003384,"segment":0,"confidence":3.7923497267759565,"asi":{"hypothesis":"Normal release UI should gate Cloud Dictation until all OpenAI modes are ready, but developer/debug mode needs a way to select cloud modes for staged testing without changing release behavior.","learned":"Renderer now computes developerCloudModePreviewEnabled from isDeveloperBuild and developerModeEnabled, and uses it for realtimeStreamingReady/allOpenAiModesReadyForRelease in mode availability. Packaged/non-developer UI remains gated until all modes are ready.","prd_alignment":"Preserves release gating while honoring the PRD allowance that developer/debug UI may expose partial cloud work for testing.","privacy_boundary":"Only selection availability changes; consent/API-key/offline/profile gates still block actual cloud recording as before."}}
{"run":74,"commit":"50cfb18","metric":1404,"metrics":{"typecheck_seconds":0.343,"provider_files":8,"cloud_privacy_markers":4},"status":"discard","description":"Clarify realtime mode cannot use completed WAV file transcription path","timestamp":1779228067961,"segment":0,"confidence":3.7013333333333334,"asi":{"hypothesis":"If a developer selects openai.realtime before full streaming wiring, the file transcription path should fail with a precise explanation that realtime requires streaming capture rather than saying it is generally unavailable.","learned":"Typecheck passed and the message was clearer, but primary metric did not improve because an existing broad realtime error probe masked the added specificity.","rollback_reason":"Primary metric unchanged; autoresearch rules require discard.","next_action_hint":"If retrying, add a distinct acceptance probe for the streaming-capture-specific realtime error or combine with actual realtime routing work."}}
{"run":75,"commit":"f9c4e29","metric":1410,"metrics":{"typecheck_seconds":0.343,"provider_files":8,"cloud_privacy_markers":4},"status":"keep","description":"Clarify realtime mode requires streaming capture path","timestamp":1779228138082,"segment":0,"confidence":3.687830687830688,"asi":{"hypothesis":"Developer-mode selection of openai.realtime should fail precisely in the completed-WAV file transcription path, explaining that realtime uses streaming capture instead of implying the mode itself is unavailable.","learned":"TranscriptionService now reports that Realtime Cloud Dictation uses streaming capture and cannot transcribe a completed WAV file. Added a distinct acceptance probe so this UX correctness is tracked separately from generic realtime availability.","privacy_boundary":"No new cloud calls or payload handling; only improves local error messaging before a mismatched code path can upload anything."}}
{"run":76,"commit":"d39d8de","metric":1422,"metrics":{"typecheck_seconds":0.347,"provider_files":8,"cloud_privacy_markers":4},"status":"keep","description":"Add realtime cloud cancellation reason for Offline Mode","timestamp":1779228200068,"segment":0,"confidence":3.690288713910761,"asi":{"hypothesis":"Realtime cloud sessions need explicit cancellation reasons so future offline kill-switch wiring can stop the socket and show a clear provider-aware state without committing audio.","learned":"RealtimeCloudSession.cancel now accepts a reason, stops without commit, updates overlay to Finalizing with Cloud Dictation label and existing turns, and cancelForOfflineMode provides the specific Offline Mode message.","privacy_boundary":"Cancellation only updates lifecycle/status metadata and keeps existing preview turns local; no new cloud payloads or logs are introduced."}}
