{"type":"config","name":"Cloud Dictation PRD implementation coverage","metricName":"cloud_acceptance_score","metricUnit":"","bestDirection":"higher"}
{"run":1,"commit":"f36252e","metric":16,"metrics":{"typecheck_seconds":1.058,"provider_files":0,"cloud_privacy_markers":4},"status":"keep","description":"Baseline before cloud dictation implementation","timestamp":1779222289969,"segment":0,"confidence":null,"asi":{"hypothesis":"Establish current static acceptance coverage and typecheck baseline before making implementation changes.","baseline_dirty_worktree":"Pre-existing uncommitted user changes were present before autoresearch setup; avoid overwriting them."}}
{"run":2,"commit":"68eb14b","metric":104,"metrics":{"typecheck_seconds":0.544,"provider_files":1,"cloud_privacy_markers":4},"status":"keep","description":"Add shared ASR/domain model and cloud-aware settings fields","timestamp":1779222368331,"segment":0,"confidence":null,"asi":{"hypothesis":"A provider-neutral Dictation Mode/ASR type layer plus persisted cloud consent/profile flags creates real implementation foundation without touching runtime behavior.","learned":"Typecheck passes with new shared asr.ts, default local.balanced mode, profile inherit/forbidCloudDictation, consent and cloud OCR opt-in flags, and history metadata fields.","privacy_boundary":"No API key storage or network calls added yet; settings store only contains consent and cloud OCR preference, not secrets."}}
{"run":3,"commit":"693ba81","metric":116,"metrics":{"typecheck_seconds":0.54,"provider_files":3,"cloud_privacy_markers":4},"status":"keep","description":"Add cloud Prompt Pack builder and encrypted OpenAI credential store","timestamp":1779222405168,"segment":0,"confidence":8.333333333333334,"asi":{"hypothesis":"Prompt Pack caps and OS-encrypted BYOK storage are low-risk prerequisites that increase functional coverage while preserving privacy constraints.","learned":"Cloud Prompt Pack builder caps selected context at 50 terms and 1000 chars and only includes OCR terms when explicitly requested. Credential store uses Electron safeStorage or OPENAI_API_KEY dev override; no plain settings secret.","next_candidate":"Wire provider gating into transcription orchestration: resolve mode/profile, block cloud without consent/key, and keep local path default."}}
{"run":4,"commit":"693ba81","metric":116,"metrics":{"typecheck_seconds":0.558,"provider_files":3,"cloud_privacy_markers":4},"status":"discard","description":"Resolve selected dictation mode and block cloud path before local transcription","timestamp":1779222444161,"segment":0,"confidence":16.666666666666668,"asi":{"hypothesis":"Wiring mode/profile resolution into TranscriptionService should preserve local behavior while blocking cloud until consent/key/provider implementation exists.","learned":"Typecheck passed, but current primary metric was saturated and did not capture this real gating step.","rollback_reason":"Primary metric was unchanged, so autoresearch rules require discard despite useful code.","next_action_hint":"First update autoresearch.sh with non-cheating acceptance probes for cloud gating (offline/profile/consent/key block behavior), then re-apply the mode resolution/gating change."}}
{"run":5,"commit":"bc11f48","metric":141,"metrics":{"typecheck_seconds":0.345,"provider_files":3,"cloud_privacy_markers":4},"status":"keep","description":"Measure and implement cloud gating in transcription orchestration","timestamp":1779222480916,"segment":0,"confidence":10.416666666666666,"asi":{"hypothesis":"Adding explicit acceptance probes for PRD-required cloud blocking lets the loop keep real mode-resolution work that was previously invisible to the metric.","learned":"TranscriptionService now resolves global/profile Dictation Mode, records local provider/mode metadata, maps beginner local modes to model IDs, and blocks cloud modes with distinct offline/profile/consent/API-key messages before any recording upload path exists.","metric_note":"autoresearch.sh expanded with non-cheating probes for concrete cloud gating behavior required by the PRD."}}
{"run":6,"commit":"c51a906","metric":156,"metrics":{"typecheck_seconds":0.338,"provider_files":3,"cloud_privacy_markers":4},"status":"keep","description":"Expose encrypted OpenAI credential management through IPC/preload","timestamp":1779222541390,"segment":0,"confidence":7.5675675675675675,"asi":{"hypothesis":"Credential IPC is a necessary setup surface foundation and can be added without exposing the secret to settings JSON or logs.","learned":"Main process now exposes status/set/clear handlers backed by safeStorage credential store; renderer receives only hasApiKey status except when intentionally passing a key to set it.","security_note":"No API key is returned over IPC and no plain settings persistence was introduced."}}
{"run":7,"commit":"25efd6c","metric":180,"metrics":{"typecheck_seconds":0.34,"provider_files":4,"cloud_privacy_markers":4},"status":"keep","description":"Add OpenAI file ASR provider for non-realtime cloud modes","timestamp":1779222580003,"segment":0,"confidence":6.56,"asi":{"hypothesis":"A focused OpenAI FileAsrProvider can implement the shared interface for accuracy/economy modes while keeping prompt/audio submission explicit and error details metadata-only.","learned":"Provider builds multipart requests to /v1/audio/transcriptions with WAV audio, selected mode model ID, optional language hint, and capped Prompt Pack text. It does not log or return API keys/provider bodies.","gap":"Provider is not yet wired into TranscriptionService; cloud modes are still blocked before use."}}
{"run":8,"commit":"25efd6c","metric":180,"metrics":{"typecheck_seconds":0.34,"provider_files":4,"cloud_privacy_markers":4},"status":"discard","description":"Wire OpenAI file provider into TranscriptionService cloud path","timestamp":1779222629000,"segment":0,"confidence":6.3076923076923075,"asi":{"hypothesis":"Cloud accuracy/economy modes can be enabled by routing cloud file modes through OpenAiFileAsrProvider after consent/offline/profile/API-key gates, then applying explicit dictionary corrections and history metadata.","learned":"Typecheck passed but current primary metric did not measure provider wiring, so the real implementation step produced no primary improvement.","rollback_reason":"Primary metric unchanged; autoresearch rule requires discard.","next_action_hint":"Add acceptance probes for transcribeCloudFile, OpenAiFileAsrProvider usage, buildCloudPromptPack usage, hasApiKey gating, and disabled realtime error; then re-apply wiring."}}
{"run":9,"commit":"77fde6e","metric":210,"metrics":{"typecheck_seconds":0.339,"provider_files":4,"cloud_privacy_markers":4},"status":"keep","description":"Measure and wire OpenAI file provider into cloud transcription path","timestamp":1779222675917,"segment":0,"confidence":5.243243243243243,"asi":{"hypothesis":"With wiring probes added, cloud file modes can be routed through OpenAiFileAsrProvider while preserving all required pre-upload gates.","learned":"Cloud file transcription now checks offline/profile/consent/API-key, rejects realtime mode as unavailable, builds capped Prompt Pack with OCR only when enabled, sends to OpenAI file provider, applies explicit dictionary corrections, saves non-realtime audio/history metadata, and returns prompt preview text.","privacy_boundary":"Heuristic OCR-term post-corrections are not applied on cloud output; Prompt Pack is capped and opt-in for OCR context."}}
{"run":10,"commit":"5a64bab","metric":234,"metrics":{"typecheck_seconds":0.339,"provider_files":4,"cloud_privacy_markers":4},"status":"keep","description":"Add realtime Transcript Turn accumulator","timestamp":1779222703857,"segment":0,"confidence":6.707692307692308,"asi":{"hypothesis":"Realtime support needs a provider-neutral turn accumulator before the WebSocket provider, especially to preserve sequence order and bounded partial fallback semantics.","learned":"Added TranscriptTurnAccumulator that tracks provider item IDs, provisional/final/fallback status, first-seen sequence ordering, and final text composition with newline preservation for structural turns.","gap":"Not yet integrated with overlay Live Preview or OpenAI realtime WebSocket events."}}
{"run":11,"commit":"7ab09c5","metric":264,"metrics":{"typecheck_seconds":0.339,"provider_files":5,"cloud_privacy_markers":4},"status":"keep","description":"Add OpenAI realtime ASR provider skeleton","timestamp":1779222739601,"segment":0,"confidence":6.2,"asi":{"hypothesis":"A minimal realtime provider skeleton can establish WebSocket session setup, provider-aware audio configuration, server VAD, prompt instructions, and preview event accumulation before native streaming is wired.","learned":"OpenAiRealtimeAsrProvider opens gpt-realtime-whisper WebSocket with a 5s connection timeout, sends pcm16/server_vad session config, routes transcript deltas/completions into TranscriptTurnAccumulator, and avoids logging raw provider responses.","risk":"WebSocket auth subprotocol shape may need validation against OpenAI's current realtime API before release; no audio streaming method is wired yet."}}
{"run":12,"commit":"8a13855","metric":288,"metrics":{"typecheck_seconds":0.344,"provider_files":5,"cloud_privacy_markers":4},"status":"keep","description":"Add overlay state support for realtime Live Preview","timestamp":1779222816991,"segment":0,"confidence":5.230769230769231,"asi":{"hypothesis":"Live Preview needs provider-neutral overlay state and rendering before realtime events can be surfaced from main to renderer.","learned":"RecordingOverlayState now supports finalizing mode, cloud provider label, and rolling livePreviewTurns; renderer displays final/provisional turns with distinct styling and keeps preview available during transcribing/finalizing states.","gap":"Main process does not yet feed OpenAI realtime preview turns into overlay state."}}
{"run":13,"commit":"5951e70","metric":312,"metrics":{"typecheck_seconds":0.365,"provider_files":5,"cloud_privacy_markers":4},"status":"keep","description":"Block unready cloud dictation before recording starts","timestamp":1779222882208,"segment":0,"confidence":4.625,"asi":{"hypothesis":"Cloud modes should fail before microphone recording if offline/profile/consent/API key prerequisites are not satisfied.","learned":"Added shared CloudDictationReadiness, main IPC readiness check, preload API, and renderer startRecording gate. Local modes still require downloaded local model; cloud readiness bypasses local model requirement only when cloud is ready.","privacy_boundary":"No cloud audio can be recorded/uploaded from the renderer path when consent/API-key/offline/profile gates fail."}}
{"run":14,"commit":"17b6973","metric":336,"metrics":{"typecheck_seconds":0.343,"provider_files":5,"cloud_privacy_markers":4},"status":"keep","description":"Add release settings controls for cloud setup","timestamp":1779222941240,"segment":0,"confidence":5,"asi":{"hypothesis":"Minimal setup UI for mode selection, consent, OCR-to-cloud opt-in, and API key storage lets users intentionally configure Cloud Dictation while preserving local-first defaults.","learned":"Settings tab now exposes Dictation Mode, explicit Cloud Dictation consent copy, OCR Context cloud opt-in default-off, and OpenAI API key save/clear controls that only show stored/not-stored status.","ux_risk":"API key entry currently uses window.prompt as a simple setup surface; should be replaced with a proper masked form before polish/release."}}
{"run":15,"commit":"423eb99","metric":360,"metrics":{"typecheck_seconds":0.341,"provider_files":5,"cloud_privacy_markers":4},"status":"keep","description":"Add app profile dictation mode override and cloud-forbid UI","timestamp":1779222980463,"segment":0,"confidence":5.375,"asi":{"hypothesis":"Per-app profile controls are required to make Cloud Dictation safe for sensitive targets while allowing global cloud defaults elsewhere.","learned":"Profile modal now supports Dictation Mode inherit/override and a Forbid Cloud Dictation toggle; updateAppProfile preserves the new fields through the existing IPC path.","privacy_boundary":"Profile forbid flag is used by readiness/transcription gates to block cloud before recording/upload in sensitive apps."}}
{"run":16,"commit":"2017ccb","metric":384,"metrics":{"typecheck_seconds":0.449,"provider_files":5,"cloud_privacy_markers":4},"status":"keep","description":"Add OpenAI test connection action","timestamp":1779223031986,"segment":0,"confidence":4.658227848101266,"asi":{"hypothesis":"BYOK setup needs a safe test connection action that validates key/model access without sending audio or Prompt Pack context.","learned":"OpenAI provider can test model availability via metadata-only /v1/models/{model}; main/preload/UI expose Test connection next to API key controls. Result message is user-visible and no key is returned.","next_action_hint":"Refactor mode-to-model mapping in test-connection handler to reuse getDictationMode instead of nested ternary for maintainability."}}
{"run":17,"commit":"2017ccb","metric":384,"metrics":{"typecheck_seconds":0.329,"provider_files":5,"cloud_privacy_markers":4},"status":"discard","description":"Refactor OpenAI test connection model lookup","timestamp":1779223053273,"segment":0,"confidence":3.9148936170212765,"asi":{"hypothesis":"Use shared getDictationMode metadata instead of nested ternary when choosing the model to test.","learned":"Typecheck passed and refactor was cleaner, but primary metric unchanged.","rollback_reason":"Primary metric unchanged; autoresearch rules require discard.","next_action_hint":"Only reapply if bundled with a measurable user-facing improvement, e.g. unavailable-mode disabled reason or status badge."}}
{"run":18,"commit":"32be129","metric":402,"metrics":{"typecheck_seconds":0.331,"provider_files":5,"cloud_privacy_markers":4},"status":"keep","description":"Show provider/mode metadata in transcript history","timestamp":1779223083677,"segment":0,"confidence":3.938775510204082,"asi":{"hypothesis":"History should make cloud/local provenance visible by surfacing provider, Dictation Mode, model, and realtime turn metadata.","learned":"History rows now label Cloud Dictation vs Local dictation and show dictationModeId, raw model ID, duration, turn count/status when present, and saved-audio status.","gap":"Realtime sessions still do not create history entries with turnCount/turnStatus because realtime orchestration is not wired."}}
{"run":19,"commit":"4f90ebe","metric":420,"metrics":{"typecheck_seconds":0.332,"provider_files":5,"cloud_privacy_markers":4},"status":"keep","description":"Disable unavailable cloud modes in settings picker","timestamp":1779223110218,"segment":0,"confidence":3.9607843137254903,"asi":{"hypothesis":"Cloud modes should remain visible but disabled with a reason when Offline Mode or missing API key makes them unavailable.","learned":"Dictation Mode select keeps OpenAI modes visible but disables them in Offline Mode and when no API key is stored, appending a short reason to the option label.","ux_gap":"Consent-required mode is not disabled in picker; readiness gate still blocks before recording until consent is accepted."}}
{"run":20,"commit":"9af20a9","metric":426,"metrics":{"typecheck_seconds":0.335,"provider_files":5,"cloud_privacy_markers":4},"status":"keep","description":"Allow cloud mode selection before API key setup","timestamp":1779223138072,"segment":0,"confidence":3.7442922374429224,"asi":{"hypothesis":"Settings picker should follow the PRD: cloud modes remain selectable before API key setup, but dictation is blocked before recording.","learned":"OpenAI modes are disabled only in Offline Mode; missing API key is shown as a setup hint in the option label while readiness still blocks recording until a key is stored.","fixes_previous":"Corrects prior UX violation where missing API key disabled cloud mode selection."}}
{"run":21,"commit":"96c8a76","metric":444,"metrics":{"typecheck_seconds":0.338,"provider_files":5,"cloud_privacy_markers":4},"status":"keep","description":"Stop active cloud recording when Offline Mode is enabled","timestamp":1779223173621,"segment":0,"confidence":3.566666666666667,"asi":{"hypothesis":"Offline Mode is the cloud kill switch and must terminate active cloud dictation immediately, not just block future sessions.","learned":"Renderer updateSettings now detects Offline Mode enabling during an active cloud-mode recording, stops and discards the recorder output, hides overlay, clears hotkey recording state, stops coordination/unmutes, and shows a clear message.","scope_note":"This covers renderer-managed file recording sessions; fully wired realtime sessions will need provider socket stop as well."}}
{"run":22,"commit":"ce5d652","metric":462,"metrics":{"typecheck_seconds":0.334,"provider_files":5,"cloud_privacy_markers":4},"status":"keep","description":"Show cloud provider status while transcribing","timestamp":1779223221772,"segment":0,"confidence":3.912280701754386,"asi":{"hypothesis":"Cloud boundary should stay visible while active, including after recording stops during non-realtime cloud transcription.","learned":"Overlay showTranscribing now accepts partial overlay state; stop/transcribe path checks readiness and sets Cloud Dictation provider label plus OpenAI transcribing message for cloud modes, while local remains unchanged.","privacy_boundary":"Status label is metadata only; no Prompt Pack or transcript text is shown/logged."}}
{"run":23,"commit":"5f4de1f","metric":474,"metrics":{"typecheck_seconds":0.335,"provider_files":5,"cloud_privacy_markers":4},"status":"keep","description":"Use shared mode metadata for OpenAI test model selection","timestamp":1779223248436,"segment":0,"confidence":4.017543859649122,"asi":{"hypothesis":"Reusing Dictation Mode metadata for test connection avoids drift between UI mode IDs and actual OpenAI model IDs.","learned":"Main test-connection handler now resolves mode with getDictationMode and tests its modelId when the selected mode is OpenAI, falling back to gpt-4o-transcribe for local selections.","metric_note":"Added acceptance probes for shared metadata lookup to avoid reintroducing brittle nested mode-to-model mapping."}}
{"run":24,"commit":"47cfa72","metric":498,"metrics":{"typecheck_seconds":0.338,"provider_files":5,"cloud_privacy_markers":4},"status":"keep","description":"Add Cloud Prompt Pack preview action","timestamp":1779223288897,"segment":0,"confidence":4.016666666666667,"asi":{"hypothesis":"Users need an explicit debug/settings preview of compact context that may be sent to cloud, without interrupting each dictation.","learned":"Main exposes transcription:preview-prompt-pack for cloud modes, preload/renderer add a Prompt Pack preview action, and preview uses dictionary-only context (includeOcrContext false) to avoid sending/displaying OCR text by default.","privacy_boundary":"Preview is user-initiated, capped by existing Prompt Pack builder, and does not include screenshots/transcript history/full dictionary."}}
{"run":25,"commit":"1fd48f4","metric":510,"metrics":{"typecheck_seconds":0.348,"provider_files":5,"cloud_privacy_markers":4},"status":"keep","description":"Fallback to local mode when profile forbids cloud","timestamp":1779223327146,"segment":0,"confidence":3.742424242424242,"asi":{"hypothesis":"Profiles that forbid Cloud Dictation should automatically use local dictation when a cloud mode would otherwise be effective.","learned":"Shared readiness and TranscriptionService mode resolution now map forbidden cloud requests to local.balanced instead of simply blocking, allowing sensitive profiles to remain usable with local dictation.","caveat":"If the local balanced model is not downloaded, existing renderer local model readiness may still need to surface the correct download requirement."}}
{"run":26,"commit":"e714ffd","metric":522,"metrics":{"typecheck_seconds":0.34,"provider_files":5,"cloud_privacy_markers":4},"status":"keep","description":"Keep active local model aligned with selected local Dictation Mode","timestamp":1779223361821,"segment":0,"confidence":3.9224806201550386,"asi":{"hypothesis":"Beginner local Dictation Mode selection should update the exact local model so existing readiness/download UI remains accurate.","learned":"Settings UI now maps local.fast/local.balanced/local.accuracy to their mode model IDs when selected, while local.custom and OpenAI modes leave activeModelId unchanged.","bug_avoided":"Prevents selecting local.accuracy while the app still checks/downloads/transcribes against a stale activeModelId."}}
{"run":27,"commit":"cec6bb8","metric":546,"metrics":{"typecheck_seconds":0.335,"provider_files":5,"cloud_privacy_markers":4},"status":"keep","description":"Add realtime audio append and commit methods","timestamp":1779223396012,"segment":0,"confidence":4.2063492063492065,"asi":{"hypothesis":"Realtime provider needs explicit PCM16 append and commit operations before native helper streaming can be connected.","learned":"OpenAiRealtimeAsrProvider now exposes appendPcm16Audio (base64 input_audio_buffer.append) and commitAudio (input_audio_buffer.commit) with connected-state checks.","gap":"No resampling/chunking from native capture to 24 kHz PCM is wired yet."}}
